{
  "id": "mengqingxiang",
  "source": {
    "url": "http://jszy.whu.edu.cn/mengqingxiang/zh_CN/index.htm",
    "crawl_date": "2025-12-14"
  },
  "basic_info": {
    "name": "孟庆祥",
    "english_name": "Michael Meng",
    "title": [
      "副教授",
      "硕士生导师"
    ],
    "is_phd_supervisor": false,
    "is_master_supervisor": true,
    "department": "遥感信息工程学院",
    "college": "遥感信息工程学院",
    "employment_status": "在职"
  },
  "academic_info": {
    "education_background": [
      {
        "degree": "工学学士",
        "field": "信息系统",
        "school": "武汉测绘科技大学",
        "period": "1996.9-2000.6",
        "country": "中国"
      },
      {
        "degree": "硕士学位",
        "field": "摄影测量与遥感",
        "school": "武汉大学",
        "period": "2004.9-2006.9",
        "country": "中国"
      },
      {
        "degree": "博士学位",
        "field": "摄影测量与遥感",
        "school": "武汉大学",
        "period": "2006.9-2009.12",
        "country": "中国"
      }
    ],
    "graduation_school": "武汉大学",
    "academic_honors": [
      "2025 全国高校教师数智教育创新大赛 特等奖",
      "2025 武汉大学高等教育教学成果 一等奖",
      "2025 武汉大学人工智能赋能高等教育典型应用场景案例大赛 特等奖",
      "2025 武汉大学第五届教师教学创新大赛 一等奖",
      "2024年 浙江省自然资源科学技术奖一等奖，浙江省测绘学会等",
      "2024年 获得武汉大学“工会积极分子”称号，武汉大学",
      "2024年 第13届“中国软件杯”大学生软件设计大赛，最佳指导老师奖（国家级）",
      "2024年 本科优秀学位论文指导老师，武汉大学",
      "2024年 应急与安全科技进步特等奖，广东省安全生产协会",
      "2024年 教学创新大赛二等奖，武汉大学",
      "2024年 武汉大学英诺大学生创新成果奖，特等奖，武汉大学",
      "2023 教学成果二等奖，武汉大学",
      "2023 第七届“教书育人奖”，武汉大学遥感信息工程学院",
      "第21届SuperMap杯高校GIS大赛，获优秀指导教师称号",
      "2023年 第12届“中国软件杯”大学生软件设计大赛，最佳指导老师奖，国家级",
      "2023年全国大学生测绘学科创新创业智能大赛开发设计竞赛，优秀指导老师奖，国家级",
      "2023 课外创新创业优秀指导老师，武汉大学",
      "2023 本科优秀学位论文指导老师，武汉大学",
      "2023 2021-2022年度 教学业绩奖，武汉大学",
      "2022 Anti安急易，中国互联网+国家级竞赛金奖，国际级大创指导老师，国家级",
      "2022 第六届“教书育人奖”，武汉大学遥感信息工程学院",
      "2022年 第11届“中国软件杯”大学生软件设计大赛，最佳指导老师奖，国家级",
      "2022年全国大学生测绘学科创新创业智能大赛开发设计竞赛，优秀指导老师奖，国家级",
      "2022年 本科优秀学位论文指导老师，武汉大学",
      "2021 第三届“查全性教授1977奖教金”，武汉大学",
      "2020 第四届“教书育人奖”，武汉大学遥感信息工程学院",
      "2020 2019-2020学年本科优秀教学业绩奖，武汉大学",
      "2020 地理信息科技进步奖二等奖，中国地理信息产业协会 ，国家级",
      "2019 第三届“教书育人奖”，武汉大学遥感信息工程学院",
      "2019 2018-2019学年本科优秀教学业绩奖，武汉大学",
      "2018 本科优秀学士学位论文指导教师，武汉大学",
      "2014 学生工作先进个人，武汉大学"
    ],
    "academic_services": [
      "《测绘通报》、《应用科学学报》等核心期刊特约审稿人",
      "中国国际大学生创新大赛（互联网+）国家级指导教师",
      "教育部“空天信息智能服务集成公关大平台”团队成员",
      "河南省水上应急搜救专家"
    ]
  },
  "research_info": {
    "research_directions": [
      "深度学习及行业大模型",
      "空天地一体化监测规划与应急管理",
      "智慧城市及智慧化应用"
    ],
    "research_interests": [
      "机器学习",
      "数据挖掘",
      "计算机视觉",
      "空间信息服务",
      "城市三维地震灾害情景构建",
      "超高层强震动健康监测",
      "消防救援战训数字一体化"
    ],
    "research_description": "孟庆祥副教授主要从事深度学习及行业大模型、空天地一体化监测规划与应急管理、智慧城市及智慧化应用等方向的研究。其团队聚焦于空间信息服务、机器学习与数据挖掘、计算机视觉、应急管理与空天地一体化监测规划、城市三维地震灾害情景构建、超高层强震动健康监测以及消防救援战训数字一体化等前沿领域，致力于推动遥感信息工程与人工智能技术的深度融合，服务智慧城市建设与应急管理体系构建。",
    "disciplines": [
      "遥感信息工程",
      "地理信息科学",
      "计算机科学与技术",
      "人工智能"
    ],
    "field_tags": [
      "深度学习",
      "遥感卫星数据处理",
      "智慧城市",
      "应急管理",
      "空天地一体化",
      "机器学习",
      "数据挖掘",
      "计算机视觉",
      "空间信息服务",
      "智能系统"
    ]
  },
  "publication_info": {
    "publication_count": 0,
    "representative_publications": [],
    "profile_links": [
      {
        "platform": "武汉大学教师主页",
        "url": "http://jszy.whu.edu.cn/mengqingxiang/zh_CN/index.htm"
      }
    ]
  },
  "project_info": {
    "project_types": [],
    "funding_agencies": [],
    "has_international_project": false
  },
  "derived_features": {
    "research_style": {
      "is_experimental": true,
      "is_theoretical": false,
      "is_applied": true,
      "is_interdisciplinary": true
    },
    "seniority_level": "mid",
    "activity_level": "high"
  },
  "extracted_text": {
    "personal_profile": "教师姓名: 孟庆祥\n页面链接: http://jszy.whu.edu.cn/mengqingxiang/zh_CN/index.htm\n==================================================\n武汉大学 孟庆祥--中文主页--首页\n教师个人主页\n孟庆祥\n个人信息\n教师英文名称：Michael Meng\n教师拼音名称：Meng Qingxiang\n电子邮箱：\n入职时间：2012-09-01\n所在单位：遥感信息工程学院\n职务：工会委员\n学历：研究生毕业\n办公地点：武汉大学信息学部遥感信息工程学院教学实验大楼611室\n性别：男\n联系方式：QQ号码36537905\n职称：副教授\n在职信息：在职\n主要任职：工会体育委员\n毕业院校：武汉大学\n硕士生导师\n访问量：\n开通时间：--\n最后更新时间：--\n个人简介\n更多>>\n孟庆祥， 男，工学博士，副教授，硕士生导师。 l 美国George Mason（乔治梅森）大学访问学者 l 某型遥感卫星数据地面处理系统副总师 l 《测绘通报》、《应用科学学报》等核心期刊特约审稿人 l 中国国际大学生创新大赛（互联网+）国家级指导教师 l 教育部“空天信息智能服务集成公关大平台”团队成员 l 河南省水上应急搜救专家 2009年12月博士毕业于武汉大学摄影测量与遥感专业，2010年进入武汉大学地理学博士后流动站工作。2015年作为访问学者...\n教育经历\n更多>>\n1996.9-2000.6\n武汉测绘科技大学（2000年合并为武汉大学）  | 信息系统  | 工学学士学位 | 本科(学士)\n2004.9-2006.9\n武汉大学  | 摄影测量与遥感  | 硕士学位 | 硕士研究生\n2006.9-2009.12\n武汉大学  | 摄影测量与遥感  | 博士学位 | 博士\n工作经历\n更多>>\n2023.11-至今\n遥感信息工程学院 | 武汉大学\n| 副教授\n2014.11-2015.12\n地理系 | 美国GMU（乔治梅森大学）  |&nbspVisiting Scholar\n2012.9-2023.11\n遥感信息工程学院 | 武汉大学\n| 讲师\n社会兼职\n更多>>\n2022.1-至今\n河南省水上应急搜救专家\n2022.9-至今\n中国大学生创新创业大赛（互联网+）国家级指导教师\n2021.9-至今\n期刊特约审稿人\n研究方向\n更多>>\n● 深度学习及行业大模型\n​● 空天地一体化监测规划与应急管理\n● 智慧城市及智慧化应用\n曾获荣誉\n2025    2025 全国高校教师数智教育创新大赛 特等奖\n2025    2025 武汉大学高等教育教学成果 一等奖\n2025    2025 武汉大学人工智能赋能高等教育典型应用场景案例大赛 特等奖\n2025    2025 武汉大学第五届教师教学创新大赛 一等奖\n2024    2024年 浙江省自然资源科学技术奖一等奖，浙江省测绘学会等\n2024    2024年 获得武汉大学“工会积极分子”称号，武汉大学\n2024    2024年 第13届“中国软件杯”大学生软件设计大赛，最佳指导老师奖（国家级），“中国软件杯”组委会\n2024    2024年 本科优秀学位论文指导老师，武汉大学\n2024    2024年 应急与安全科技进步特等奖，广东省安全生产协会\n2024    2024年 教学创新大赛二等奖，武汉大学\n2024    2024年 武汉大学英诺大学生创新成果奖，特等奖，武汉大学\n2023    2023 教学成果二等奖，武汉大学\n2023    2023 第七届“教书育人奖”，武汉大学遥感信息工程学院\n2023    第21届SuperMap杯高校GIS大赛，获优秀指导教师称号\n2023    2023年 第12届“中国软件杯”大学生软件设计大赛，最佳指导老师奖，国家级\n2023    2023年全国大学生测绘学科创新创业智能大赛开发设计竞赛，优秀指导老师奖，国家级\n2023    2023 课外创新创业优秀指导老师，武汉大学\n2023    2023 本科优秀学位论文指导老师，武汉大学\n2023    2023 2021-2022年度 教学业绩奖，武汉大学\n2022    Anti安急易，中国互联网+国家级竞赛金奖，国际级大创指导老师，国家级\n2022    2022 第六届“教书育人奖”，武汉大学遥感信息工程学院\n2022    2022年 第11届“中国软件杯”大学生软件设计大赛，最佳指导老师奖，国家级\n2022    2022年全国大学生测绘学科创新创业智能大赛开发设计竞赛，优秀指导老师奖，国家级\n2022    本科优秀学位论文指导老师，武汉大学\n2021    2021 第三届“查全性教授1977奖教金”，武汉大学\n2020    第四届“教书育人奖”，武汉大学遥感信息工程学院\n2020    2019-2020学年本科优秀教学业绩奖，武汉大学\n2020    地理信息科技进步奖二等奖，中国地理信息产业协会 ，国家级\n2019    第三届“教书育人奖”，武汉大学遥感信息工程学院\n2019    2018-2019学年本科优秀教学业绩奖，武汉大学\n2018    本科优秀学士学位论文指导教师，武汉大学\n2014    学生工作先进个人，武汉大学\n团队成员\n更多>>\n智慧城市智慧化应用\n团队研究方向：     1、智慧城市及智慧化应用     2、空间信息服务、机器学习及数据挖掘     3、计算机视觉CV     4、应急管理与空天地一体化监测规划     5、城市三维地震灾害情景构建     6、超高层强震动健康监测     7、消防救援战训数字一体化​团队研究生毕业就业情况：     近年来，团队主攻科研项目的顶层设计、平台软件框架设计开发，主要运用互联网技术栈，学生以动手能力强、信息化构架系统性强、技术栈先进等特点进入互联网企业较多（鹅厂、华为、百度、字节、vivo、高德、拼多多、快手、比亚迪、小鹏、淘宝、滴滴等），部分同学已经成为产业界专家。     1、已指导/联合指导硕士/博士多人。硕士毕业生中多人进入互联网公司实习或者工作，包括拼多多、美团、百度、腾讯、vivo、高德、华为、小鹏、字节跳动等。     2、指导学生多次在国内外（中国国际大学生创新大赛、挑战杯、计算机设计大赛、测绘创新创业大赛、网络挑战杯、软件杯、美赛等）比赛中获奖。    3、部分研究生考取省级选调生成为公务员。学生团队：23级博士研究生：姚凯旋25级硕士研究生：就等你啦24级硕士研究生：苏比（少骨计划）、黄晓轩、刘宇航、姚齐、王帆、石佳欣等23级硕士研究生：冯苑君、肖开荣、石沈、谢笑篱、郑伟业等22级硕士研究生：颜凯伦等21级硕士研究生：王传立、贺星宇、李春梅、张雨杭、陈嘉岳、杨凡等20级硕士研究生：钟源、段学琳、刘力燃、郑洁茹、叶雅方、豆京怡等19级硕士研究生：张俊、向枫、吴康庄等18级硕士研究生：李强、吴明东、闻俏等17级硕士研究生：王鸿绪、孔云鹏、赖新果等16级硕士研究生：吴玄等\n新闻网中文官网\n",
    "research_section": "",
    "education_section": ""
  }
}