{
  "id": "qinkun",
  "source": {
    "url": "http://jszy.whu.edu.cn/qinkun/zh_CN/index.htm",
    "crawl_date": "2025-12-14"
  },
  "basic_info": {
    "name": "秦昆",
    "english_name": "Kun Qin",
    "title": [
      "教授",
      "博士生导师",
      "硕士生导师"
    ],
    "is_phd_supervisor": true,
    "is_master_supervisor": true,
    "department": "遥感信息工程学院",
    "college": "遥感信息工程学院",
    "employment_status": "在职"
  },
  "academic_info": {
    "education_background": [
      {
        "degree": "博士",
        "field": "摄影测量与遥感",
        "school": "武汉大学",
        "period": "2000.9-2004.6",
        "country": "中国"
      },
      {
        "degree": "硕士",
        "field": "地图学与遥感",
        "school": "南京师范大学",
        "period": "1995.9-1998.6",
        "country": "中国"
      },
      {
        "degree": "学士",
        "field": "自然地理(基地班)",
        "school": "兰州大学",
        "period": "1991.9-1995.6",
        "country": "中国"
      }
    ],
    "graduation_school": "武汉大学",
    "academic_honors": [
      "武汉大学“2025年”魏桥校长奖教金(遥感科学与技术数智教育创新教学团队)",
      "自然资源科学技术奖(科技进步奖)二等奖(排2)",
      "武汉大学遥感信息工程学院第九届“教书育人奖”",
      "2024年中国地理科学十大研究进展:地理流空间分析理论与重大应用(排名5)",
      "湖北省科协优秀科技论文(2023年度)",
      "武汉大学2022-2023学年本科优秀教学业绩奖",
      "2022年高等教育(本科)国家级教学成果一等奖(排名3)",
      "全国高校宝钢教育优秀教师奖",
      "2022年湖北省教学成果特等奖（排名3）",
      "湖北省省级一流本科课程《地理信息系统基础》",
      "湖北省省级一流本科课程《空间数据分析》",
      "武汉大学优秀教材特等奖（排名2）",
      "武汉大学“珞珈抗疫.十大线上教学人物”",
      "武汉大学2019-2020学年本科优秀教学业绩奖",
      "武汉大学教学成果奖特等奖(排名2)",
      "武汉大学“烛光导航工程”优秀导航师",
      "武汉大学优秀本科教学管理工作者(2012)",
      "湖北省优秀学士学位论文指导教师奖(2010)",
      "湖北省优秀学士学位论文指导教师奖(2009)",
      "湖北省优秀学士学位论文指导教师奖(2007)",
      "湖北省科技进步奖二等奖(排名10)",
      "江苏省科学技术进步奖三等奖(排名3)"
    ],
    "academic_services": [
      "高等学校遥感科学与技术系列教材编审委员会副主任",
      "高等学校遥感信息工程实践与创新系列教材编审委员会副主任",
      "武汉大学遥感科学与技术教材基地负责人",
      "中国地理学会理事",
      "中国地理学会空间综合人文社会科学工作委员会主任",
      "中国地理学会地理模型与地理信息分析专业委员会委员",
      "中国测绘学会教育工作委员会委员",
      "中国遥感应用协会社会遥感地理计算专业委员会主任",
      "中国遥感应用协会黄土高原遥感分会副理事长",
      "测绘遥感信息工程全国重点实验室兼职教授",
      "珞珈实验室兼职教授",
      "中国地理信息产业协会理论与方法工作委员会委员",
      "民航安全工程技术研究中心暨北京市民航安全分析及预防工程技术研究中心技术委员会委员",
      "民航卫星应用工程技术研究中心技术委员会委员",
      "中国人工智能协会社会计算与社会智能专业委员会委员、社会计算与空间计算学组副主任"
    ]
  },
  "research_info": {
    "research_directions": [
      "时空大数据分析与挖掘",
      "遥感图像挖掘与智能分析",
      "空间人文社会地理计算"
    ],
    "research_interests": [
      "时空大数据",
      "遥感图像智能分析",
      "地理计算",
      "空间人文社会科学",
      "地理信息分析",
      "社会遥感",
      "空间流分析"
    ],
    "research_description": "秦昆教授主要从事时空大数据分析与挖掘、遥感图像挖掘与智能分析、空间人文社会地理计算等方向的研究。其研究聚焦于地理信息科学与人工智能的交叉领域，致力于推动遥感技术在人文社会科学研究中的应用，特别是在地理流空间分析理论与重大应用方面取得重要进展。研究成果获2024年中国地理科学十大研究进展，并在教材建设、教学创新与科技奖励方面获得多项荣誉。",
    "disciplines": [
      "遥感科学与技术",
      "地理信息科学",
      "空间分析",
      "人工智能与地理计算"
    ],
    "field_tags": [
      "时空大数据",
      "遥感图像分析",
      "地理计算",
      "空间人文地理",
      "智能分析",
      "地理信息科学",
      "社会遥感",
      "地理流分析"
    ]
  },
  "publication_info": {
    "publication_count": 0,
    "representative_publications": [],
    "profile_links": [
      {
        "platform": "武汉大学教师主页",
        "url": "http://jszy.whu.edu.cn/qinkun/zh_CN/index.htm"
      }
    ]
  },
  "project_info": {
    "project_types": [],
    "funding_agencies": [],
    "has_international_project": false
  },
  "derived_features": {
    "research_style": {
      "is_experimental": true,
      "is_theoretical": true,
      "is_applied": true,
      "is_interdisciplinary": true
    },
    "seniority_level": "senior",
    "activity_level": "high"
  },
  "extracted_text": {
    "personal_profile": "教师姓名: 秦昆\n页面链接: http://jszy.whu.edu.cn/qinkun/zh_CN/index.htm\n==================================================\n武汉大学 秦昆--中文主页--首页\n教师个人主页\n秦昆\n个人信息\n教师英文名称：Kun Qin\n教师拼音名称：Qin Kun\n电子邮箱：\n所在单位：遥感信息工程学院\n学历：研究生毕业\n办公地点：教学实验大楼6楼\n性别：男\n联系方式：qink@whu.edu.cn\n职称：教授\n在职信息：在职\n主要任职：武汉大学遥感信息工程学院教学督导组组长；高等学校遥感科学与技术系列教材编审委员会副主任\n博士生导师\n硕士生导师\n同专业博导\n同专业硕导\n访问量：\n开通时间：--\n最后更新时间：--\n个人简介\n更多>>\n秦昆，博士、博士后，三级教授、博士生导师。武汉大学遥感信息工程学院教授、院教学督导组组长、院教授委员会副主任；高等学校遥感科学与技术系列教材编审委员会副主任、高等学校遥感信息工程实践与创新系列教材编审委员会副主任、武汉大学遥感科学与技术教材基地负责人；中国地理学会理事、中国地理学会空间综合人文社会科学工作委员会主任、中国地理学会地理模型与地理信息分析专业委员会委员；中国测绘学会教育工作委员会委员；中国遥感应用协会社会遥感地理计算专业委员主任、中国遥感应用协会黄土高原遥感分...\n教育经历\n更多>>\n2000.9-2004.6\n武汉大学  | 摄影测量与遥感  | 博士 | 博士\n1995.9-1998.6\n南京师范大学  | 地图学与遥感  | 硕士 | 硕士\n1991.9-1995.6\n兰州大学  | 自然地理(基地班)  | 学士学位 | 本科(学士)\n工作经历\n更多>>\n2023.11-至今\n遥感信息工程学院 | 武汉大学\n| 三级教授、博士生导师\n2020.9-至今\n遥感信息工程学院 | 武汉大学\n| 教学督导组组长\n2015.7-2020.6\n遥感信息工程学院 | 武汉大学\n| 副院长  | 教授\n社会兼职\n中国地理学会理事中国地理学会空间综合人文社会科学工作委员会主任中国遥感应用协会社会遥感地理计算专业委员会主任高等学校遥感科学与技术系列教材编审委员会副主任高等学校遥感信息工程实践与创新系列教材编审委员会副主任高等学校遥感科学与技术教材基地负责人测绘遥感信息工程全国重点实验室兼职教授珞珈实验室兼职教授中国地理信息产业协会理论与方法工作委员会委员中国地理学会地理模型与地理信息分析专业委员会委员中国测绘学会教育委员会委员民航安全工程技术研究中心暨北京市民航安全分析及预防工程技术研究中心技术委员会委员民航卫星应用工程技术研究中心技术委员会委员中国人工智能协会社会计算与社会智能专业委员会委员、社会计算与空间计算学组副主任中国遥感应用协会黄土高原遥感分会副理事长\n研究方向\n更多>>\n时空大数据分析与挖掘(Spatiotemporal Big Data Analysis and Mining, SBDA)\n遥感图像挖掘与智能分析(Remote Sensing Image Mining and Intelligent Analysis, RSIA)\n空间人文社会地理计算(Geocomputaiton for Humanities and Social Sciences, GHSS)\n曾获荣誉\n2025    武汉大学“2025年”魏桥校长奖教金(遥感科学与技术数智教育创新教学团队)\n2025    自然资源科学技术奖(科技进步奖)二等奖(排2)\n2025    武汉大学遥感信息工程学院第九届“教书育人奖”\n2025    2024年中国地理科学十大研究进展:地理流空间分析理论与重大应用(排名5)\n2024    湖北省科协优秀科技论文(2023年度)\n2023    武汉大学2022-2023学年本科优秀教学业绩奖\n2023    2022年高等教育(本科)国家级教学成果一等奖(排名3)\n2023    全国高校宝钢教育优秀教师奖\n2023    2022年湖北省教学成果特等奖（排名3）\n2022    湖北省省级一流本科课程《地理信息系统基础》\n2021    湖北省省级一流本科课程《空间数据分析》\n2021    武汉大学优秀教材特等奖（排名2）\n2020    武汉大学“珞珈抗疫.十大线上教学人物”\n2020    武汉大学2019-2020学年本科优秀教学业绩奖\n2019    武汉大学教学成果奖特等奖(排名2)\n2013    武汉大学“烛光导航工程”优秀导航师\n2012    武汉大学优秀本科教学管理工作者(2012)\n2010    湖北省优秀学士学位论文指导教师奖(2010)\n2009    湖北省优秀学士学位论文指导教师奖(2009)\n2007    湖北省优秀学士学位论文指导教师奖(2007)\n2001    湖北省科技进步奖二等奖(排名10)\n1998    江苏省科学技术进步奖三等奖(排名3)\n团队成员\n更多>>\n时空大数据分析团队(WHU-SBD)\n武汉大学时空大数据分析团队（SBD: Spatio-temporal Big Data Analysis）\n周扬2022...\n陈昆2019...\n张静怡202...\n章昊文202...\n夏梓杰202...\n蒲媛雪202...\n乔治浩202...\n邢玲丽202...\n梁天祺202...\n王宇帆202...\n邵子龙202...\n许艳青教授\n肖锐教授\n卢宾宾教授\n贾涛副教授\n许刚副研究员\n崔卫红副教授\n余洋-讲师\n新闻网中文官网\n",
    "research_section": "",
    "education_section": ""
  }
}