{
  "id": "xieguohua",
  "source": {
    "url": "http://jszy.whu.edu.cn/xieguohua/zh_CN/index.htm",
    "crawl_date": "2025-12-14"
  },
  "basic_info": {
    "name": "谢国华",
    "english_name": "Guohua Xie",
    "title": [
      "教授",
      "博士生导师",
      "硕士生导师"
    ],
    "is_phd_supervisor": true,
    "is_master_supervisor": true,
    "department": "微电子学与固体电子学",
    "college": "化学与分子科学学院",
    "employment_status": "在职"
  },
  "academic_info": {
    "education_background": [
      {
        "degree": "理学博士学位",
        "field": "微电子学与固体电子学",
        "school": "吉林大学电子科学与工程学院",
        "period": "2008.09-2011.06",
        "country": "中国"
      },
      {
        "degree": "理学硕士学位",
        "field": "微电子学与固体电子学",
        "school": "吉林大学电子科学与工程学院",
        "period": "2006.09-2008.06",
        "country": "中国"
      },
      {
        "degree": "工学学士学位",
        "field": "电子科学与技术",
        "school": "吉林大学电子科学与工程学院",
        "period": "2002.09-2006.06",
        "country": "中国"
      }
    ],
    "graduation_school": "吉林大学",
    "academic_honors": [
      "洪堡学者"
    ],
    "academic_services": [
      "《SmartMat》青年编委",
      "《The Innovation》青年编委",
      "《发光学报》青年编委"
    ]
  },
  "research_info": {
    "research_directions": [
      "有机半导体材料与器件",
      "有机光电转换与显示技术",
      "柔性电子与可穿戴设备"
    ],
    "research_interests": [
      "OLED器件",
      "有机光伏器件",
      "有机光电探测器",
      "热激活延迟荧光材料",
      "溶液法制备技术",
      "微纳加工与光调控"
    ],
    "research_description": "谢国华教授长期致力于有机半导体材料与器件的基础与应用研究，聚焦于有机电致发光器件（OLED）、有机光伏器件（OPV）、有机光电探测器（OPD）等新型有机光电功能材料与器件的开发。研究涵盖热激活延迟荧光（TADF）材料、量子点发光器件、钙钛矿电池、微腔结构调控、纳米压印技术、空间相干性调控、可穿戴柔性电子器件等前沿方向。在溶液法制备、电学掺杂、载流子传输与注入、器件稳定性与效率提升等方面取得系列创新成果，成功研制我国首台QVGA格式OLED微显示器，并在高效率、低滚降、深蓝光、窄发射光谱OLED器件方面实现突破。",
    "disciplines": [
      "微电子学与固体电子学",
      "有机化学"
    ],
    "field_tags": [
      "OLED",
      "TADF",
      "有机光电材料",
      "溶液加工",
      "柔性电子",
      "可穿戴设备",
      "微纳加工",
      "光电转换"
    ]
  },
  "publication_info": {
    "publication_count": 208,
    "representative_publications": [
      {
        "title": "Post-synthesis of Lewis acid-base adducts as thermally activated delayed fluorescence radical emitters for color-tunable displays and encryption via inkjet printing",
        "keywords": [
          "Lewis acid-base adducts",
          "thermally activated delayed fluorescence",
          "inkjet printing",
          "color-tunable displays",
          "encryption"
        ],
        "journal_name": "Chemical Engineering Journal",
        "research_fields": [
          "有机光电材料",
          "有机发光器件",
          "溶液法制备",
          "显示技术"
        ],
        "publication_year": 2022
      },
      {
        "title": "High performance circularly polarized electroluminescence with simultaneous narrowband emission, high efficiency and large dissymmetry factor",
        "keywords": [
          "圆偏振发光",
          "窄带发射",
          "高效率",
          "大不对称因子",
          "OLED"
        ],
        "journal_name": "Advanced Materials",
        "research_fields": [
          "有机发光器件",
          "圆偏振光",
          "光电材料",
          "显示技术"
        ],
        "publication_year": 2022
      },
      {
        "title": "Solution-processed AIEgen NIR OLEDs with EQE approaching 15%",
        "keywords": [
          "AIEgen",
          "近红外OLED",
          "溶液法制备",
          "外部量子效率",
          "有机发光二极管"
        ],
        "journal_name": "Angewandte Chemie International Edition",
        "research_fields": [
          "有机光电材料",
          "近红外发光",
          "溶液加工",
          "OLED器件"
        ],
        "publication_year": 2022
      },
      {
        "title": "Tetracoordinate boron-based multifunctional chiral thermally activated delayed fluorescence emitters",
        "keywords": [
          "四配位硼",
          "手性TADF",
          "热激活延迟荧光",
          "有机发光材料",
          "OLED"
        ],
        "journal_name": "Angewandte Chemie International Edition",
        "research_fields": [
          "有机光电材料",
          "TADF材料",
          "手性发光",
          "OLED器件"
        ],
        "publication_year": 2022
      },
      {
        "title": "Topological design of highly anisotropic aligned hole transporting molecular bottlebrushes for solution-processed OLEDs",
        "keywords": [
          "拓扑设计",
          "各向异性",
          "分子刷",
          "空穴传输",
          "溶液加工OLED"
        ],
        "journal_name": "Journal of the American Chemical Society",
        "research_fields": [
          "有机半导体",
          "分子工程",
          "溶液加工器件",
          "OLED"
        ],
        "publication_year": 2022
      }
    ],
    "profile_links": [
      {
        "platform": "ResearchGate",
        "url": "https://www.researchgate.net/profile/Guohua_Xie"
      },
      {
        "platform": "ResearcherID",
        "url": "http://www.researcherid.com/rid/C-1688-2010"
      },
      {
        "platform": "ORCID",
        "url": "https://orcid.org/0000-0003-0764-7889"
      }
    ]
  },
  "project_info": {
    "project_types": [
      "国家自然科学基金",
      "973",
      "863"
    ],
    "funding_agencies": [
      "国家自然科学基金委员会",
      "科技部"
    ],
    "has_international_project": true
  },
  "derived_features": {
    "research_style": {
      "is_experimental": true,
      "is_theoretical": false,
      "is_applied": true,
      "is_interdisciplinary": true
    },
    "seniority_level": "mid",
    "activity_level": "high"
  },
  "extracted_text": {
    "personal_profile": "教师姓名: 谢国华\n页面链接: http://jszy.whu.edu.cn/xieguohua/zh_CN/index.htm\n==================================================\n武汉大学 谢国华--中文主页--首页\nEnglish\n中文\n谢国华\n同专业博导\n同专业硕导\n首页\n科学研究\n研究领域\n论文成果\n专利\n著作成果\n科研项目\n科研团队\n教学研究\n教学资源\n授课信息\n教学成果\n获奖信息\n招生信息\n学生信息\n我的相册\n教师博客\n微信扫描\n个人信息\n1\n博士生导师\n硕士生导师\n教师英文名称：Guohua Xie\n电子邮箱：\n入职时间：2015-01-01\n学历：博士研究生毕业\n办公地点：化西五楼503\n性别：男\n联系方式：027-68752330\n在职信息：在职\n毕业院校：Jilin University\n所属院系：\n化学与分子科学学院\n学科：\n微电子学与固体电子学\n有机化学\n个人简介\n详见如下链接：\nhttp://faculty.whu.edu.cn/show.jsp?n=Guohua%20Xie&lang=cn\n工作经历\n2015.01-至今，武汉大学化学与分子科学学院，湖北省有机/高分子光电功能材料重点实验室（副研究员）\n2013.01-2015.01，英国圣安德鲁斯大学，有机半导体中心 （博士后）\n2012.01-2012.12，德国德累斯顿工业大学应用光物理研究所（洪堡学者）\n2011.08-2012.12，德国弗劳恩霍夫研究所IPMS（COMEDD部门）（洪堡学者）\n教育经历\n2008.09-2011.06，吉林大学电子科学与工程学院，集成光电子学国家重点联合实验室\n微电子学与固体电子学专业，理学博士学位\n2006.09-2008.06，吉林大学电子科学与工程学院，集成光电子学国家重点联合实验室\n微电子学与固体电子学专业，理学硕士学位\n2002.09-2006.06，吉林大学电子科学与工程学院\n电子科学与技术专业，工学学士学位\n研究领域与兴趣\n有机半导体，有机光电材料和器件\n关键词：有机电致发光器件(OLED）、有机光伏器件(OPV）、有机光电探测器(OPD）、有机激光(OLD）、量子点、钙钛矿、光电转换、电学掺杂、微腔、纳米压印、干涉、微显示器、有源显示、柔性电子、可穿戴设备、……\n***\n欢迎有材料、化学、物理、电子、光学等学科背景，以及对交叉学科研究感兴趣的同学加入我们的团队。\n***\n科研成果\nhttps://www.researchgate.net/profile/Guohua_Xie\nhttp://www.researcherid.com/rid/C-1688-2010\nhttps://orcid.org/0000-0003-0764-7889\n主要研究经历\n12. 原位后合成的喷墨打印发光器件\n11. 荧光敏化机理探索和新应用研究\n10. 非真空法、无溶剂残留多层薄膜材料和制备工艺研究。\n9.\n(a) 研究适用于湿法制备的新型OLED材料和器件，比如聚合物和低聚物，热激活延迟荧光材料及其相应器件。\n(b) 研究应用于量子点发光器件、有机光伏器件、有机光电探测器、钙钛矿电池和发光二极管的新型载流子注入和传输材料和器件结构。\n8.\n(a) 研究有机发光器件（OLED、PLED和Organic Laser）的空间干涉特性。采用基于纳米压印技术指标的亚波长周期的光栅结构调制光的空间相干特性以应用于生物医学治疗和传感。\n(b) 搭建了世界上第一套探测有机发光器件空间相干长度的系统。\n(c) 将OLED与玻璃基底金属光栅集成，实现宽谱的部分相干光\n(d) 利用光栅结构、微腔结构、机械摩擦等形式实现具有一定偏振特性的OLED。\n(e) 研究可穿戴的OLED与聚合物光电探测器的集成技术以应用于生物医学传感和治疗。\n(f) 研究溶液法制备基于热激活延迟荧光（TADF）特性的小分子OLED、深蓝光OLED和深红光、窄发射光谱。实现了首个具有离子型、兼容电化学发光的非掺杂型TADF OLED。\n7.\n(a) 在德国洪堡基金会资助下，研究OLED的热学稳定性，实现了可在100oC温度下工作的器件。\n(b) 基于电学掺杂技术，首次实现了基于有机隧穿结的 P-I-N-P 型顶发射OLED，1000 cd/m2亮度下的寿命达到超长的50万小时。\n6.\n(a) 研究有机半导体的电学掺杂技术和物理。\n(b) “973”项目课题 2003CB314703（硅上有机发光微显示器件及其物理研究）后期工作主要完成人之一和2010CB327701（硅上有机微显示器高品质化及其物理研究）前期工作主要完成人之一，上述课题均以“优秀”结题。\n(c) 于2008年夏天成功研制了我国第一款自主研发的QVGA格式OLED微显示器(0.52英寸对角线)。\n5. 研究低驱动电压和高发光效率的OLED与中小尺寸有源显示衬底的集成技术。与韩国首尔大学Prof. Seung-Ki Joo 课题组共同研制基于p-沟道低温多晶硅衬底的底发射型有源显示OLED（2英寸对角线）。\n4. 研究基于晶圆厂标准CMOS工艺的全彩色微显示器硅基衬底与顶发射白光OLED的集成技术。首次利用与下一代CMOS金属互连技术兼容的铜衬底实现高效的宽谱顶发射白光OLED。\n3. 与南京邮电大学黄维教授课题组和黑龙江大学许辉教授课题组共同开发非掺杂性深蓝光OLED和基于膦氧主题的高效蓝光和白光磷光OLED。\n2. 研究新型的过渡金属氧化物/金属/过渡金属氧化物多层透明电极在聚合物太阳能电池和OLED中的应用。\n1. 有机光电器件的光电性能模拟。\n教学情况\n研究生课程：《有机光电材料化学》\n本科生课程：《先进材料薄膜技术》\n其他贡献:\n《SmartMat》、《The Innovation》、《发光学报》等期刊青年编委。\n文章列表:\nhttps://www.researchgate.net/profile/Guohua_Xie\nhttp://www.researcherid.com/rid/C-1688-2010\nhttps://orcid.org/0000-0003-0764-7889\n2022\n[208] Post-synthesis from Lewis acid-base interaction: an alternative way to generate light and harvest triplet excitons\nHengjia Liu and Guohua Xie*,\nBeilstein Journal of Organic Chemistry, 2022, 18: 825-836.\nhttp://doi.org/10.3762/bjoc.18.83\nThis article is part of the thematic issue “Organic TADF materials design”.\n[207] Tetradentate Pt(II) complexes with peripheral hindrances for highly efficient solution-processed blue phosphorescent OLEDs\nLu Zhu, Chenwei Sha, Anqi Lv, Wang Xie, Kang Shen, Yumeng Chen, Guohua Xie*, Huili Ma, Hongbo Li, and Xiao-Chun Hang*\nInorganic Chemistry, 2022, 61(27): 10402-10409\nhttp://doi.org/10.1021/acs.inorgchem.2c01063\n[206] Regioselective Syntheses of Imidazo[4,5-b]pyrazin-2-ylidene Based Chelates and Blue Emissive Iridium(III) Phosphors for Solution Processed OLEDs\nJie Yan, Qin Xue, Hui Yang, Shek-Man Yiu, Ye-Xin Zhang*, Guohua Xie*, and Yun Chi*\nInorganic Chemistry, 2022, 61(23): 8797-8805\nhttp://doi.org/10.1021/acs.inorgchem.2c00750\n[206] Optical gain at 637 nm wavelength in polymer waveguide amplifier under commercial LED pumping for planar photonic integration\nCe Wang, Xin Liu, Baoping Zhang, Guohua Xie*, Zhaoqin Zhou, Xingchen Yang, Leiying Ying, Yang Mei, Wang Fan, Zhensheng Lin, Zhiwei Zheng, and Dan Zhang*\nAdvanced Optical Materials, 2022, 10(13): 2200205\nhttp://doi.org/10.1002/adom.202200205\n[205] A novel method for the synthesis of carbon dots assisted by free radicals\nXinyue Zhou, Kebing Yi, Yeling Yang, Guohua Xie*, Xinghu Ji*, and Zhike He*\nNano Research, 2022, (): -\nhttp://doi.org/10.1007/s12274-022-4567-0\nhttps://www.sciopen.com/article/10.1007/s12274-022-4567-0\n[204] Post-synthesis of Lewis acid-base adducts as thermally activated delayed fluorescence radical emitters for color-tunable displays and encryption via inkjet printing\nHengjia Liu, Yang Tang, Ao Ying, Yuhan Gao, Xiaoyun Chen, Ling Zhou, Jinliang Lin, and Guohua Xie*\nChemical Engineering Journal, 2022, 444(-): 136642\nhttp://doi.org/10.1016/j.cej.2022.136642\n[203] Exploiting new feasibility of a phenylquinoline unit for establishing efficient green thermally activated delayed fluorescent emitter with short delayed fluorescent lifetime\nTengxiao Liu* and Guohua Xie*,\nOrganic Electronics, 2022, 106(-): 106518\nhttp://doi.org/10.1016/j.orgel.2022.106518\n[202] Tetracoordinate boron-based multifunctional chiral thermally activated delayed fluorescence emitters\nLing Zhou, Fan Ni, Nan Li, Kai Wang, Guohua Xie*, and Chuluo Yang*\nAngewandte Chemie International Edition, 2022, 61(28): e202203844\nhttp://doi.org/10.1002/anie.202203844\nThis article also appears in : Hot Topic Organic Electronics\n[201] Topological design of highly anisotropic aligned hole transporting molecular bottlebrushes for solution-processed OLEDs\nNari Kang, Sangho Cho, Eric E. Leonhardt, Chun Liu, Stanislav V. Verkhoturov, William Henry Hunter Woodward, Michael J. Eller, Tianyu Yuan, Thomas C. Fitzgibbons, Yannick P. Borguet, Ashlee A. Jahnke, Anatoliy N. Sokolov, Travis Mcintire, Carl Reinhardt, Lei Fang, Emile A. Schweikert, Liam Patrick Spencer, Guorong Sun*, Guohua Xie*, Peter Trefonas*, and Karen Wooley*\nJournal of the American Chemical Society, 2022, 144(18): 8084-8095\nhttp://doi.org/10.1021/jacs.2c00420\n[200] Solution-processed AIEgen NIR OLEDs with EQE approaching 15%\nYing Yu, Hao Xing, Dan Liu, Mengying Zhao, Herman H.-Y. Sung, Ian D. Williams, Jacky W. Y. Lam, Guohua Xie*, Zheng Zhao*, and Ben Zhong Tang*\nAngewandte Chemie International Edition, 2022, 61(26): e202204279\nhttp://doi.org/10.1002/anie.202204279\nSelected as Organic Light-Emitting Diodes Hot Paper\n[199] Tuning the structures of polypyridinium salts as bifunctional cathode interfacial layers for all-solution-processed red quantum-dot light-emitting diodes\nShuguang Fu, Xiaojun Yin*, Yang Tang, Guohua Xie*, and Chuluo Yang*\nChinese Chemical Letters, 2022, (): -\nhttp://doi.org/10.1016/j.cclet.2022.04.009\n[198] High performance circularly polarized electroluminescence with simultaneous narrowband emission, high efficiency and large dissymmetry factor\nZhanxiang Chen, Cheng Zhong, Jianmei Han, Jingsheng Miao, Yanyu Qi, Yang Zou, Guohua Xie, Shaolong Gong, and Chuluo Yang*\nAdvanced Materials, 2022, 34(17): 2109147\nhttp://doi.org/10.1002/adma.202109147\n[197] Catalysing n-doping\nGuohua Xie*, and Karl Leo*\nThe Innovation, 2022, 3(2):100219\nhttp://doi.org/10.1016/j.xinn.2022.100219\n[196] Numerical simulation of S-shaped current-voltage curves induced by electron traps in inverted organic photovoltaics\nShanglin Luo, Mingfang Huo, Qin Xue*, and Guohua Xie*\nInternational Journal of Molecular Sciences, 2022, 23(4): 2039\nhttp://doi.org/10.3390/ijms23042039\n[195] Manipulating Förster and Dexter interactions between thermally activated delayed fluorescence host and phosphorescent dopant for highly efficient solution-processed red and white OLEDs\nYang Tang, Yuan Liu, Weimin Ning, Lisi Zhan, Junqiao Ding*, Maolin Yu, Hengjia Liu, Yuhan Gao, Guohua Xie*, and Chuluo Yang*\nJournal of Materials Chemistry C, 2022, 10(12): 4637-4645\nhttp://doi.org/10.1039/D1TC05470H\n[194] Ester substitutued thiophene-fused benzothiadiazole as a strong electron-acceptor to build D-A red-emitters for highly efficient solution-processed OLEDs\nXiaoxiao Wang, Cheng Zhong*, Guohua Xie*, and Xingguo Chen*\nJournal of Materials Chemistry C, 2022, 10(3): 1127-1135\nhttp://doi.org/10.1039/D1TC04941K\n[193] Molecular engineering by σ-linkers enables delayed fluorescence emitters fro high-efficiency sky-blue solution-processed OLEDs\nYanying Chen, Nengquan Li, Zhongyan Huang*, Guohua Xie, and Chuluo Yang*\nChemical Engineering Journal, 2022, 430(3): 133078\nhttp://doi.org/10.1016/j.cej.2021.133078\n[192] A discrete platinum (II) metallacycle harvesting triplet excitons for solution-processed deep-red organic light-emitting diodes\nHao Xing, Ying Yu, Junkai Liu, Peng Qin, Jacky Wing Yip Lam, Bingbing Shi*, Guohua Xie*, and Ben Zhong Tang*\nAdvanced Optical Materials, 2022, 10(4): 2101925\nhttp://doi.org/10.1002/adom.202101925\n2021\n[191] Blue light-emitting diodes based halide perovskites: recent advances and strategies\nJianfeng Zhang, Lin Wang*, Xiaoyu Zhang, Guohua Xie, Jianhua Zhang, and Xuyang Yang*\nMaterials Today, 2021, 51(-): 222-246\nhttp://doi.org/10.1016/j.mattod.2021.10.023\n[190] Remove the water-induced traps toward improved performance in organic solar cells\nMumin Shi, Tao Wang, Rui Sun, Qiang Wu, Dandan Pei, Hui Wang, Wenyan Yang, Wei Wang, Yao Wu, Guohua Xie, Tao Wang, Long Ye, and Jie Min*\nScience China Materials, 2021, 64(11): 2629-2644\nhttp://doi.org/10.1007/s40843-021-1703-4\n[189] Converting thermally activated delayed fluorescence into hybridized local and charge-transfer via an additional acceptor moiety\nMengyu Zhao, Qiang Wei*, Jiasen Zhang, Wei Li, Zhichuan Wang, Songyu Du, Qin Xue, Guohua Xie*, and Ziyi Ge*\nOrganic Electronics, 2021, 100(-): 106365\nhttp://doi.org/10.1016/j.orgel.2021.106365\n[188] Solution-processable chiral boron complexes for circularly polarized red thermally activated delayed fluorescent devices\nPeiran Xue, Xin Wang, Wuji Wang, Jingyu Zhang, Zijie Wang, Jibiao Jin, Chao Zheng*, Ping Li, Guohua Xie*, and Runfeng Chen*\nACS Applied Materials and Interfaces, 2021, 13(40): 47826-47834\nhttp://doi.org/10.1021/acsami.1c13564\n[187] Copper(I) complex as sensitizer enables high-performance organic light-emitting diodes with very low efficiency roll-off\nLisi Zhan, Ao Ying, Yanyu Qi, Kailong WU, Yang Tang, Yang Zou, Guohua Xie, Shaolong Gong*, and Chuluo Yang*\nAdvanced Functional Materials, 2021, 31(48): 2106345\nhttp://doi.org/10.1002/adfm.202106345\n[186] Novel aggregation-induced delayed fluorescence luminogen for vacuum-deposited and solution-processed OLEDs with very small efficiency roll-offs\nHuijun Liu, Shaoxin Song, Hao Chen, Zujin Zhao*, Guohua Xie*, and Ben Zhong Tang\nOrganic Electronics, 2021, 99(-): 106339\nhttp://doi.org/10.1016/j.orgel.2021.106339\n[185] FA/MA cation exchange for efficient and reproducible tin-based perovskite solar cells\nFangjie Li, Xiaoyi Hou, Zhen Wang, Xiaxia Cui, Guohua Xie, Feng Yan*, Xin-Zhong Zhao*, and Qidong Tai*\nACS Applied Materials and Interfaces, 2021, 13(34): 40656-40663\nhttp://doi.org/10.1021/acsami.1c11751\n[184] Solution-processed multiple exciplexes via spirofluorene and S-triazine moieties for red thermally activated delayed fluorescence emissive layer OLEDs\nTing Xu, Guohua Xie*, Taian Huang, He Liu, Xiaocong Cao, Yang Tang, and Chuluo Yang*\nOrganic Electronics, 2021, 96(-): 106184\nhttp://doi.org/10.1016/j.orgel.2021.106184\n[183] Triazatruxene based star-shaped thermally activated delayed fluorescence emitters: modulating the performance of solution-processed non-doped OLEDs via side-group engineering\nSuraj Kumar Pathak, He Liu*, Changjiang Zhou, Guohua Xie*, and Chuluo Yang*\nJournal of Materials Chemistry C, 2021, 9(23): 7363-7373\nhttp://doi.org/10.1039/D1TC01000J\n[182] Solution-processed pure blue thermally activated delayed fluorescence emitter organic light-emitting diodes with narrowband emission\nTing Xu*, Xiao Liang, and Guohua Xie*\nFrontiers in Chemistry, 2021, 9(-): 691172\nhttp://doi.org/10.3389/fchem.2021.691172\n[181] Difluoroboron locking tactic enhances photo- and electroluminescence of TADF emitter\nLisi Zhan, Weimin Ning, Shaolong Gong*, Guohua Xie*, and Chuluo Yang*\nDyes and Pigments, 2021, 192(-): 109392\nhttp://doi.org/10.1016/j.dyepig.2021.109392\n[180] Sky-blue thermally activated delayed fluorescence polymers by using a conjugation-confined poly(aryl ethers) main chain\nTianheng Chen, Zhanxiang Chen, Fan Ni, Guohua Xie*, and Chuluo Yang*\nPolymer Chemistry, 2021, 12(16): 2490-2497\nhttp://doi.org/10.1039/D1PY00170A\n[179] Perovskite light-emitting devices with doped hole transporting layer\nZhiwei Peng†, Yuhan Gao†, and Guohua Xie*\nMolecules, 2021, 26(6): 1670\n(†Equal contribution)\nhttps://doi.org/10.3390/molecules26061670\n[178] Thermally activated delayed fluorescence beyond through-bond charge transfer for high-performance OLEDs\nQin Xue and Guohua Xie*\nAdvanced Optical Materials, 2021, 9(14): 2002204\nhttp://doi.org/10.1002/adom.202002204\n(This is an invited review article dedicated to Professor Karl Leo on the occasion of his 60th birthday.)\n[177] Simple-structured blue thermally activated delayed fluorescence emitter for solution-processed organic light-emitting diodes with external quantum efficiency over 20%\nJiasen Zhang, Qiang Wei*, Nannan Fei, Mengyu Zhao, Lin Xie, Liang Cao, Xiaoli Zhang, Guohua Xie*, Tao Wang*, and Ziyi Ge*\nACS Applied Materials and Interfaces, 2021, 13(10): 12305-12312\nhttp://doi.org/10.1021/acsami.1c00412\n[176] Constructing donor-resonance-donor molecules for acceptor-free bipolar organic semiconductors\nHe Jiang, Jibiao Jin, Zijie Wang, Wuji Wang, Runfeng Chen*, Ye Tao, Qin Xue, Chao Zheng, Guohua Xie*, and Wei Huang*\nResearch, 2021, 2021(-): 9525802\nhttp://doi.org/10.34133/2021/9525802\n[175] Intermolecular locking design of red thermally activated delayed fluorescence molecules for high-performance solution-processed organic light-emitting diodes\nJibiao Jin, Wuji Wang, Peiran Xue, Qingqing Yang, He Jiang, Ye Tao, Chao Zheng*, Guohua Xie*, Wei Huang, and Runfeng Chen*\nJournal of Materials Chemistry C, 2021, 9(7): 2291-2297\nhttp://doi.org/10.1039/D0TC05624C\nThis article is part of the themed collection: Journal of Materials Chemistry C HOT Papers\n[174] Highly efficient blue TADF emitters incorporating bulky acridine moieties and their application in solution-processed OLEDs\nQiaodeng Chen, Yepeng Xiang, Xiaojun Yin, Kai Hu, Yongfeng Li, Xiaoling Cheng, Yuan Liu*, Guohua Xie*, and Chuluo Yang*\nDyes and Pigments, 2021, 188(-): 109157\nhttp://doi.org/10.1016/j.dyepig.2021.109157\n[173] Solution-processed multi-resonance organic light-emitting diodes with high efficiency and narrowband emission\nShen Xu, Qingqing Yang, Hui Li, Qin Xue, Guohua Xie*, Minzhao Gu, Jibiao Jin, Ling Huang*, and Runfeng Chen*\nChinese Chemical Letters, 2021, 32(4): 1372-1376\nhttp://doi.org/10.1016/j.cclet.2020.10.022\n[172] A solution-processable wholly-aromatic bipolar host material for highly efficient blue electroluminescent devices\nJie Yuan*, He Jiang, Qingqing Yang, Yuan Xiang, Ying Zhang, Yizhong Dai, Ping Li, Chao Zheng, Guohua Xie*, and Runfeng Chen*\nJournal of Materials Chemistry C, 2021, 9(2): 687-692\nhttp://doi.org/10.1039/D0TC05150K\n2020\n[171] Editorial: Recent Advances in Thermally Activated Delayed Fluorescence Materials\nChihaya Adachi, Guohua Xie, Sebastian Reineke, and Eli Zysman-Colman*\nFrontiers in Chemistry, 8 (2020) 625910\nhttps://www.frontiersin.org/articles/10.3389/fchem.2020.625910/full\n[170] Highly efficient thermally activated delayed fluorescence via an unconjugated donor-acceptor system realizing EQE of over 30%\nChen-Chen Peng, Sheng-Yi Yang, Hong-Cheng Li, Guo-Hua Xie, Lin-Song Cui, Sheng-Nan Zou, Cyril Poriel, Zuo-Quan Jiang*, and Liang-Sheng Liao*\nAdvanced Materials, 32 (2020) 2003885\nhttp://doi.org/10.1002/adma.202003885\n[169] Atomic precision graphene model compound for bright electrochemiluminescence and organic light-emitting diodes\nLiuqing Yang, Arthur D. Hendsbee, Qin Xue, Shuijian He, Cindy R. De-Jager, Guohua Xie*, Gregory C. Welch*, and Zhifeng Ding*\nACS Applied Materials and Interfaces, 12 (2020) 51736-51743\nhttp://doi.org/10.1021/acsami.0c16238\n[168] Blue-phosphorescent Pt(II) complexes of tetradentate pyridyl-carbolinyl ligands: synthesis, photophysics, and electroluminescence\nFeiling Yu, Yongjian Sheng, Dandan Wu, Ke Qin, Hongbo Li, Guohua Xie*, Qin Xue, Zhengyi Sun, Zhenzhong Lu, Huili Ma, and Xiao-Chun Hang\nInorganic Chemistry, 59 (2020) 14493-14500\nhttp://doi.org/10.1021/acs.inorgchem.0c02244\n[167] Emerging circularly polarized thermally activated delayed fluorescence materials and devices: a perspective\nLing Zhou, Guohua Xie*, Fan Ni, and Chuluo Yang*\nApplied Physics Letters, 117 (2020) 130502\nhttp://doi.org/10.1063/5.0021127\n(Selected as an Editor’s Pick)\n[166] Optical properties of organic neodymium complexes doped optical waveguide based on intramolecular energy transfer effect\nHong Zhan, Jing Zhang, Wang Fan, Baoping Zhang, Leiying Ying, Guohua Xie, Zhensheng Lin, Haosheng Chen, Hao Long, Zhongming Zheng, Zhiwei Zheng, Hui Xu*, and Dan Zhang*\nOptical Materials Express, 10 (2020) 2624-2635\nhttp://doi.org/10.1364/OME.400344\n[165] Rigidity and polymerization amplified red thermally activated delayed fluorescence polymers for constructing red and single-emissive-layer white OLEDs\nTao Wang, Kuofei Li, Bing Yao, Yuannan Chen, Hongmei Zhan*, Zhiyuan Xie, Guohua Xie*, Xiaohu Yi, and Yanxiang Cheng*\nAdvanced Functional Materials, 30 (2020) 2002493\nhttp://doi.org/10.1002/adfm.202002493\n[164] Resonance hosts for high efficiency solution-processed blue and white electrophosphorescent devices\nHuanhuan Li, Jibiao Jin, Yuan Xiang, Ying Zhang, Ye Tao, Mingguang Li, Qin Xue, Guohua Xie*, Wei Huang, and Runfeng Chen*\nScience China Chemistry, 63 (2020) 1645-1651\nhttp://doi.org/10.1007/s11426-020-9823-7\n[163] π-stacked thermally activated delayed fluorescence emitters with alkyl chain modulation\nTong-Tong Wang, Guohua Xie*, Hong-Cheng Li, Sheng-Yi Yang, Hao Li, Yan-Ling Xiao, Cheng Zhong, Kumar Sarvendra, Aziz Khan, Zuo-Quan Jiang*, and Liang-Sheng Liao\nCCS Chemistry, 2 (2020) 1757-1763\nhttp://doi.org/10.31635/ccschem.020.202000355\n[162] Pyrido[2,3-b]pyrazine based full-color fluorescent materials for high-performance OLEDs\nLing Yu, Zhongbin Wu, Guohua Xie, Jiajia Luo, Yang Zou, Dongge Ma*, and Chuluo Yang*\nJournal of Materials Chemistry C, 8 (2020) 12445-12449\nhttp://doi.org/10.1039/D0TC02412K\n[161] Thermally activated delayed fluorescent polymer-assisted morphological control on perfluorinated ionomer enriched surface and exciton harvesting for phosphorescent organic light-emitting devices\nYuhan Gao, Yang Tang, Hengjia Liu, Guohua Xie*, and Chuluo Yang*\nDyes and Pigments, 183 (2020) 108718\nhttp://doi.org/10.1016/j.dyepig.2020.108718\n[160] Regulating the photophysical properties of highly twisted TADF emitters by concurrent through-space/-bond charge transfer\nXialei Lv, Yaxiong Wang, Nengquan Li, Xiaosong Cao, Guohua Xie, Hong Huang, Cheng Zhong, Lei Wang*, and Chuluo Yang*\nChemical Engineering Journal, 402 (2020) 126173\nhttp://doi.org/10.1016/j.cej.2020.126173\n[159] Triplet manipulation for strong luminescence\nGuohua Xie* and Liming Ding*\nScience Bulletin, 65 (2020) 1780-1782\nhttp://doi.org/10.1016/j.scib.2020.07.004\n[158] Sky-blue thermally activated delayed fluorescence polymers with π-interrupted polymer mainchain via Friedel-Crafts polycondensation\nXiang Zhou, Manli Huang, Xuan Zeng, Cheng Zhong, Guohua Xie, Shaolong Gong, Xiaosong Cao, and Chuluo Yang*\nPolymer, 204 (2020) 122722\nhttp://doi.org/10.1016/j.polymer.2020.122722\n[157] Unravelling electroplex emission from long-range charge transfer based on a phosphorescent dendrimer as the electron donor\nYang Tang, Guohua Xie*, Xiaojun Yin, Yuhan Gao, Junqiao Ding*, and Chuluo Yang*\nJournal of Physical Chemistry Letters, 11 (2020) 5255-5262\nhttp://doi.org/10.1021/acs.jpclett.0c01482\n[156] Easily reproducible top-emitting organic light-emitting devices for microdisplays adapted to aluminum contact from the standard CMOS processes\nQin Xue and Guohua Xie*\nJournal of Information Display, 21 (2020) 131-137\nhttp://doi.org/10.1080/15980316.2020.1773551\n[155] Monoradically luminescent polymers by a super acid-catalyzed polymerization and deep-red electroluminescence\nKebin An, Guohua Xie*, Shaolong Gong*, Zhanxiang Chen, Xiang Zhou, Fan Ni, and Chuluo Yang*\nScience China Chemistry, 63 (2020) 1214-1220\nhttp://engine.scichina.com/doi/10.1007/s11426-020-9778-9\nhttp://doi.org/10.1007/s11426-020-9778-9\n[154] Superacid-catalyzed Friedel-Crafts polyhydroxyalkylation: a straightforward method to construct sky-blue thermally activated delayed fluorescence polymers\nXiang Zhou, Manli Huang, Xuan Zeng, Cheng Zhong, Guohua Xie, Xiaosong Cao, Changan Yang*, and Chuluo Yang*\nPolymer Chemistry, 11 (2020) 3481-3487\nhttp://doi.org/10.1039/D0PY00469C\n[153] Organic and quantum-dot hybrid white LEDs using a narrow bandwidth blue TADF emitter\nYang Tang, Guohua Xie*, Xiao Liang, You-Xuan Zheng, and Chuluo Yang*\nJournal of Materials Chemistry C, 8 (2020) 10831-10836\nhttp://doi.org/10.1039/D0TC01942A\nThis article is part of the themed collection:\nJournal of Materials Chemistry C Emerging Investigators\n[152] Fused tetracyclic tris[1,2,4]triazolo[1,3,5]triazine as a novel rigid electron acceptor for efficient thermally activated delayed fluorescence emitters\nSuraj Kumar Pathak, Yepeng Xiang, Manli Huang, Taian Huang, Xiaosong Cao, He Liu*, Guohua Xie, and Chuluo Yang*\nRSC Advances, 10 (2020) 15523-15529\nhttp://doi.org/10.1039/D0RA01925A\n[151] Molecular engineering by σ-bond spacer enables solution-processable host materials for TADF emitter towards high-performance OLEDs\nNengquan Li, Danyang Chai, Zhanxiang Chen, Changjiang Zhou, Fan Ni, Zhongyan Huang, Xiaosong Cao, Guohua Xie*, and Chuluo Yang*\nChemical Engineering Journal, 396 (2020) 125276\nhttp://doi.org/10.1016/j.cej.2020.125276\n[150] Saturated red electroluminescence from thermally activated delayed fluorescence conjugated polymers\nHongmei Zhan, Yanjie Wang, Kuofei Li, Yuannan Chen, Xiaohu Yi*, Keyan Bai, Guohua Xie*, and Yanxiang Cheng*\nFrontiers in Chemistry, 8 (2020) 332\nhttp://doi.org/10.3389/fchem.2020.00332\n[149] Highly emissive dinuclear platinum(III) complexes\nXiugang Wu, Deng-Gao Chen, Denghui Liu, Shih-Hung Liu, Shin-Wei Shen, Chih-I Wu, Guohua Xie, Jianwei Zhou, Zhi-Xuan Huang, Chun-Ying Huang, Shi-Jian Su, Weiguo Zhu*, and Pi-Tai Zhou*\nJournal of the American Chemical Society, 142 (2020) 7469-7479\nhttp://doi.org/10.1021/jacs.9b13956\n[148] Star-shaped thermally activated delayed fluorescence emitters with a tri-armed arylsulfonic acceptor for efficient solution-processed organic light emitting diodes\nRan Xiao, Yepeng Xiang, Xiaosong Cao, Nengquan Li, Taian Huang, Changjiang Zhou, Yang Zou, Guohua Xie, and Chuluo Yang*\nJournal of Materials Chemistry C, 8 (2020) 5580-5586\nhttp://doi.org/10.1039/C9TC07049D\n[147] Achieving 21% external quantum efficiency for solution-processed sky-blue thermally activated delayed fluorescence OLEDs by means of multi-donor/acceptor emitter with through-space/-bond charge transfer\nXujun Zheng, Rongjuan Huang, Cheng Zhong, Guohua Xie*, Weimin Ning, Manli Huang, Fan Ni, Fernando B. Dias*, and Chuluo Yang*\nAdvanced Science, 7 (2020) 1902087\nhttp://doi.org/10.1002/advs.201902087\n[146] Protonation-induced dual fluorescence of a blue fluorescence material with twisted A-π-D-π-A configuration\nJingjing Yang, Xing Liu, Zemei Liu, Long Wang, Jing Sun, Zhen Guo, Huixia Xu, Hua Wang*, Bo Zhao*, and Guohua Xie*\nJournal of Materials Chemistry C, 8 (2020) 2442-2450\nhttp://doi.org/10.1039/C9TC06425G\n[145] Benzoylpyridine-based TADF emitters with AIE feature for efficient non-doped OLEDs by both evaporation and solution process\nXue Zhou, Yepeng Xiang, Fan Ni, Yang Zou*, Zhanxiang Chen, Xiaojun Yin, Guohua Xie, Shaolong Gong, and Chuluo Yang*\nDyes and Pigments, 176 (2020) 108179\nhttp://doi.org/10.1016/j.dyepig.2019.108179\n[144] Bis(benzothiophene-S,S-dioxide) fused small molecules realize solution-processible, high-performance and non-doped blue organic light-emitting diodes\nLiwen Hu, Siyang Liu, Guohua Xie*, Wei Yang, and Bin Zhang*\nJournal of Materials Chemistry C, 8 (2020) 1002-1009\nhttp://doi.org/10.1039/C9TC05019A\n[143] High-efficiency white organic light-emitting diodes based on all nondoped thermally activated delayed fluorescence emitters\nGuang-Hui Zhang, Feng-Ming Xie, Kailong Wu, Yan-Qing Li*, Guohua Xie*, Shi-Jie Zou, Yang Shen, Xin Zhao, Chuluo Yang*, and Jian-Xin Tang*\nAdvanced Materials Interfaces, 7 (2020) 1901758\nhttp://doi.org/10.1002/admi.201901758\n[142] Electroluminescence of intra-molecular exciplexes based on novel Lewis acid borane acceptors and a high triplet level donor\nMinli Zhang, Guohua Xie*, Qin Xue, and Hong-Bo Wang*\nChemical Engineering Journal, 380 (2020) 122527\nhttp://doi.org/10.1016/j.cej.2019.122527\n[141] Manipulating the doping level via host-dopant synergism towards high performance n-type thermoelectric composites\nXiaojun Yin, Fei Zhong, Zhanxiang Chen, Chunmei Gao, Guohua Xie, Lei Wang*, and Chuluo Yang*\nChemical Engineering Journal, 382 (2020) 122817\nhttp://doi.org/10.1016/j.cej.2019.122817\n[140] Transfer printing of polymer light-emitting devices with a small molecular seeding layer featuring thermally activated delayed fluorescence for triplet harvesting\nYang Tang, Yuhan Gao, Guohua Xie*, and Chuluo Yang*\nNanoscale Horizons, 5 (2020) 144-149\nhttp://doi.org/10.1039/C9NH00431A\n2019\n[139] Simple construction of deep-red hexaazatrinaphthylene-based thermally activated delayed fluorescence emitters for efficient solution-processed OLEDs with peak at 692 nm\nXue Zhou, Yepeng Xiang, Shaolong Gong*, Zhanxiang Chen, Fan Ni, Guohua Xie, and Chuluo Yang*\nChemical Communications, 55 (2019) 14190-14193\nhttp://doi.org/10.1039/C9CC06804J\n[138] Fine-tuning the photophysical properties of thermally activated delayed fluorescent emitters by torsion angles: high performance sky-blue OLED\nLisi Zhan, Yepeng Xiang, Zhanxiang Chen, Kailong Wu, Shaolong Gong, Guohua Xie, and Chuluo Yang*\nJournal of Materials Chemistry C, 7 (2019) 13953-13959\nhttp://doi.org/10.1039/C9TC04804A\n[137] A simple organic molecule realizing simultaneous TADF, RTP, AIE and mechanoluminescence: understanding the mechanism behind the multifunctional emitter\nLisi Zhan, Zhanxiang Chen, Shaolong Gong*, Yepeng Xiang, Fan Ni, Xuan Zeng, Guohua Xie, and Chuluo Yang*\nAngewandte Chemie International Edition, 58 (2019) 17651-17655\nhttp://doi.org/10.1002/anie.201910719\n[136] Photophysics and electroluminescence of red quantum dots diluted in a thermally activated delayed fluorescence host\nYepeng Xiang, Guohua Xie*, Manli Huang, and Chuluo Yang*\nJournal of Materials Chemistry C, 7 (2019) 13218-13223\nhttp://doi.org/10.1039/C9TC04340C\n[135] Thermally activated delayed fluorescence enantiomers for solution-processed circularly polarized electroluminescence\nSibing Sun, Jun Wang, Lingfeng Chen, Runfeng Chen*, Jibiao Jin, Cailin Chen, Shufen Chen, Guohua Xie*, Chao Zheng, and Wei Huang*\nJournal of Materials Chemistry C, 7 (2019) 14511-14516\nhttp://doi.org/10.1039/C9TC04941J\n[134] Multiple σ -π conjugated molecules with selectively enhanced electrical performance for efficient solution-processed blue electrophosphorescence\nHuanhuan Li, Hui Li, Yibin Zhi, Jun Wang, Lele Tang, Ye Tao*, Guohua Xie*, Chao Zheng, Wei Huang, and Runfeng Chen*\nAdvanced Optical Materials, 7 (2019) 1901124\nhttp://doi.org/10.1002/adom.201901124\n[133] Highly efficient electroluminescence from evaporation- and solution-processable orange-red thermally activated delayed fluorescence emitters\nBinyan Wang, Hannan Yang, Yaxing Zhang, Guohua Xie*, Huijuan Ran, Tao Wang, Qiang Fu, Yitao Ren, Ning Sun*, Guangtao Zhao, Jian-Yong Hu, and Qiang Wang*\nJournal of Materials Chemistry C, 7 (2019) 12321-12327\nhttp://doi.org/10.1039/C9TC04418C\n[132] High-color-purity and efficient solution-processable blue phosphorescent light-emitting diodes with Pt(II) complexes featuring 3ππ* transition\nHuili Ma, Kang Shen, Yipei Wu, Fang Xia, Feiling Yu, Zhenyi Sun, Chunyue Qian, Qiming Peng, Honghai Zhang, Cong You, Guohua Xie*, Xiaochun Hang*, and Wei Huang*\nMaterials Chemistry Frontiers, 3 (2019) 2448-2454\nhttp://doi.org/10.1039/C9QM00347A\n[131] Feasible modification of PEDOT:PSS by poly(4-styrenesulfonic acid): a universal method to double the efficiencies for solution-processed organic light-emitting devices\nYepeng Xiang, Guohua Xie*, Qian Li, Longjian Xue, Qian Xu, Junfa Zhu, Yang Tang, Shaolong Gong, Xiaojun Yin, and Chuluo Yang*\nACS Applied Materials and Interfaces, 11 (2019) 29105-29112\nhttp://doi.org/10.1021/acsami.9b09346\n[130] Thermally activated delayed fluorescence polymer emitters with tunable emission from yellow to warm white regulated by triphenylamine derivatives\nYuchao Liu, Guohua Xie, Zhongjie Ren*, and Shouke Yan*\nACS Applied Polymer Materials, 1 (2019) 2204-2212\nhttp://doi.org/10.1021/acsapm.9b00461\n[129] Combining the qualities of carbazole and tetraphenyl silane in a desirable main chain for thermally activated delayed fluorescence polymers\nXiang Zhou, Manli Huang, Xuan Zeng, Tianheng Chen, Guohua Xie, Xiaojun Yin, and Chuluo Yang*\nPolymer Chemistry, 10 (2019) 4201-4208\nhttp:doi.org/10.1039/C9PY00742C\n[128] Realizing 22.5% external quantum efficiency for solution-processed thermally activated delayed fluorescence OLEDs with red emission at 622 nm via a synergistic strategy of molecular engineering and host selection\nWeixuan Zeng, Tao Zhou, Weimin Ning, Cheng Zhong, Jiawei He, Shaolong Gong*, Guohua Xie, and Chuluo Yang*\nAdvanced Materials, 31 (2019) 1901404\nhttp://doi.org/10.1002/adma.201901404\n[127] Highly efficient sky blue electroluminescence from ligand-activated copper iodide clusters: overcoming the limitations of cluster light-emitting diodes\nMingchen Xie, Chunmiao Han, Qianqian Liang, Jing Zhang, Guohua Xie*, and Hui Xu*\nScience Advances, 5 (2019) eaav9857\nhttp://doi.org/10.1126/sciadv.aav9857\nHighlight in Nature Electronics: Ligands light up OLEDs (By Matthew Parker).\nNature Electronics, 2 (2019) 264\nhttp://doi.org/10.1038/s41928-019-0279-1\n[126] Solution-processed highly efficient bluish-green thermally activated delayed fluorescence emitter bearing asymmetric oxadiazole-difluoroboron double acceptor\nDi Zhou, Denghui Liu, Xu Gong, Huili Ma, Gaowei Qian, Shaolong Gong, Guohua Xie*, Weiguo Zhu*, and Yafei Wang*\nACS Applied Materials and Interfaces, 11 (2019) 24339-24348\nhttp://doi.org/10.1021/acsami.9b07511\n[125] Small-molecule-doped organic crystals with long-persistent luminescence\nJiangli Han, Wenhui Feng, Desissa Yadeta Muleta, Chelsea Nicole Bridgmohan, Yangyang Dang, Guohua Xie, Haoli Zhang, Xueqin Zhou, Wei Li, Lichang Wang, Dongzhi Liu, Yanfeng Dang, Tianyang Wang*, and Wenping Hu*\nAdvanced Functional Materials, 29 (2019) 1902503\nhttp://doi.org/10.1002/adfm.201902503\n[124] Enhancing spin-orbit coupling by introducing a lone pair electron with p orbital character in a thermally activated delayed fluorescence emitter: photophysics and devices\nZhanxiang Chen, Fan Ni, Zhongbin Wu, Yuchen Hou, Cheng Zhong, Manli Huang, Guohua Xie, Dongge Ma*, and Chuluo Yang*\nThe Journal of Physical Chemistry Letters, 10 (2019) 2669-2675\nhttp://doi.org/10.1021/acs.jpclett.9b00937\n[123] Boosting photoluminescence quantum yields of triarylboron/phenoxazine hybrids via incorporation of cyano groups and their applications as TADF emitters for high-performance solution-processed OLEDs\nYuan Liu, Hong Huang, Tao Zhou, Kailong Wu, Mingrong Zhu, Jie Yu, Guohua Xie, and Chuluo Yang*\nJournal of Materials Chemistry C, 7 (2019) 4778-4783\nhttp://doi.org/10.1039/C9TC00538B\n[122] Solution-processible 1,3,4-oxadiazole/spiro[fluorene-9,9’-xanthene] hybrid as efficient host for green thermally activated delayed fluorescence devices\nXiang-Hua Zhao*, Jing-Yuan Wang, Jia-Xing Wu, Yue Li, Guo-Dong Zou, Guohua Xie*, Zong-Qiong Lin, Ling-Hai Xie, Xin-Wen Zhang, and Jian-Feng Zhao*\nDyes and Pigments, 166 (2019) 168-173\nhttp://doi.org/10.1016/j.dyepig.2019.03.015\n[121] Self-assembly of a highly emissive pure organic imine-based stack for electroluminescence and cell imaging\nXujun Zheng, Wencheng Zhu, Chi Zhang, Yang Zhang, Cheng Zhong, Hao Li*, Guohua Xie*, Xiongjun Wang, and Chuluo Yang*\nJournal of the American Chemical Society, 141 (2019) 4704-4710\nhttp://doi.org/10.1021/jacs.8b13724\n[120] Realizing an efficient warm white organic light-emitting device possessing excellent color-stability and color rendering index\nYe Yu, Wenyan Lin, Xuekang Peng, Zhijun Wu*, Yu Jin, Xiaoyan Li, Xining Zhang, Huishan Yang*, and Guohua Xie*\nOrganic Electronics, 68 (2019) 129-134\nhttp://doi.org/10.1016/j.orgel.2019.01.037\n[119] Tetraphenylcyclopentadiene-based hyperbranched polymers: convenient syntheses from one pot “A4+B2” polymerization and high external quantum yields up to 9.74% in OLED devices\nYujun Xie, Yanbin Gong, Mengmeng Han, Fengyuan Zhang, Qian Peng, Guohua Xie*, and Zhen Li*\nMacromolecules, 52 (2019) 896-903\nhttp://doi.org/10.1021/acs.macromol.8b02051\n[118] Hexa-substituted benzene derivatives as hole transporting materials for efficient perovskite solar cells\nYuan Liu, Chen Tao*, Guohua Xie, Jeroen Van Der Velden, Sergio Marras, Zhenghui Luo, Xuan Zeng, Annamaria Petrozza, and Chuluo Yang*\nDyes and Pigments, 163 (2019) 267-273\nhttp://doi.org/10.1016/j.dyepig.2018.12.010\n[117] Multichannel strategies to produce stabilized azaphenalene diradicals: a predictable model to generate self-doped cathode interfacial layers for organic photovoltaics\nXiaojun Yin, Xiaohui Liu, Yuhao Peng, Weixuan Zeng, Cheng Zhong, Guohua Xie, Lei Wang*, Junfeng Fang*, and Chuluo Yang*\nAdvanced Functional Materials, 29 (2019) 1806125\nhttp://doi.org/10.1002/adfm.201806125\n[116] Simply structured near-infrared emitters with a multicyano linear acceptor for solution processed organic light-emitting diodes\nBingjie Zhao†, Guohua Xie†, Huiqin Wang, Chunmiao Han*, and Hui Xu*\nChemistry - A European Journal, 25 (2019) 1010-1017\nhttp://doi.org/10.1002/chem.201805201\nhttp://doi.org/10.1002/chem.201806286 (Cover Profile)\n(†Equal contribution)\n2018\n[115] A Cu-NHC based phosphorescent binuclear Iridium(III)/Copper(I) complex with an unpredictable near-linear two-coordination mode\nChao Shi, Manli Huang, Qiuxia Li, Guohua Xie, Chuluo Yang*, and Aihua Yuan*\nDalton Transactions, 47 (2018) 17299-17303\nhttp://doi.org/10.1039/C8DT04007A\n[114] An AIEgen-based 3D covalent organic framework for white light-emitting diodes\nHuimin Ding†, Jian Li†, Guohua Xie†, Guiqing Lin, Rufan Chen, Zhengkang Peng, Chuluo Yang, Baoshan Wang, Junliang Sun*, and Cheng Wang*\nNature Communications, 9 (2018) 5234\nhttp://doi.org/10.1038/s41467-018-07670-4\n(†Equal contribution)\n[113] Incorporating thermally activated delayed fluorescence into mechanochromic luminescent emitters: high-performance solution-processed yellow organic light emitting diodes\nXuan Zeng, Tao Zhou, Jiangle Liu, Kailong Wu, Shuqi Li, Xiao Xiao, Yu Zhang, Shaolong Gong, Guohua Xie, and Chuluo Yang*\nAdvanced Optical Materials, 6 (2018) 1801071\nhttp://doi.org/10.1002/adom.201801071\n[112] Platinum-based metallomesogens bearing Pt(4,6-dfppy)(acac) skeleton: synthesis, photophysical properties and polarized phosphorescence application\nXuefeng Yang, Xiugang Wu, Di Zhou, Junting Yu, Guohua Xie*, Duncan W. Bruce, and Yafei Wang*\nDalton Transactions, 47 (2018) 13368-13377\nhttp://doi.org/10.1039/C8DT03017K\n[111] Enhancing optical gain stability for a deep-blue emitter enabled by a low-loss transparent matrix\nJin-Qiang Pan, Jian-Peng Yi, Guohua Xie*, Wen-Yong Lai*, and Wei Huang\nJournal of Physical Chemistry C, 122 (2018) 21569-21578\nhttp://doi.org/10.1021/acs.jpcc.8b05273\n[110] Design strategy for solution-processable thermally activated delayed fluorescence emitters and their applications in organic light-emitting diodes\nYang Zou, Shaolong Gong, Guohua Xie, and Chuluo Yang*\nAdvanced Optical Materials, 6 (2018) 1800568\nhttp://doi.org/10.1002/adom.201800568\n[109] Phenylquinoline fused cyclic derivatives as electron acceptor of exciplex forming host for solution-processable red phosphorescent OLEDs\nYin Zhang, Changmei Liu Xiaochun Hang*, Qin Xue, Guohua Xie*, Cong Zhang, Tianshi Qin, Zhengyi Sun*, Zhi-Kuan Chen, and Wei Huang\nJournal of Materials Chemistry C, 6 (2018) 8035-8041\nhttp://doi.org/10.1039/C8TC02757A\n[108] Revealing the new potential of an indandione unit for constructing efficient yellow thermally activated delayed fluorescence emitters with short emissive lifetimes\nYepeng Xiang, Ze-Lin Zhu, Dongjun Xie, Shaolong Gong*, Kailong Wu, Guohua Xie, Chun-Sing Lee*, and Chuluo Yang*\nJournal of Materials Chemistry C, 6 (2018) 7111-7118\nhttp://doi.org/10.1039/C8TC01656A\n[107] Boosting the electroluminescence efficiency of solution-processed thermally activated delayed fluorescence OLEDs with a versatile hole-transporting layer of organic-inorganic hybrid perovskite\nTao Zhou, Cheng Liu, Shaolong Gong*, Yepeng Xiang, Guohua Xie, and Chuluo Yang*\nJournal of Materials Chemistry C, 6 (2018) 6305-6311\nhttp://doi.org/10.1039/C8TC01567H\n[106] Red thermally activated delayed fluorescence polymers containing 9H-thioxanthen-9-one-10,10-dioxide acceptor group as pendant or incorporated in backbone\nYanjie Wang, Yunhui Zhu, Guohua Xie*, Qin Xue, Chen Tao, Yongjun Le, Hongmei Zhan, and Yanxiang Cheng*\nOrganic Electronics, 59 (2018) 406-413\nhttp://doi.org/10.1016/j.orgel.2018.05.058\n[105] Star-shaped boron-containing asymmetric host materials for solution-processible phosphorescent organic light-emitting diodes\nJibiao Jin, Ye Tao, Runfeng Chen*, Guohua Xie*, Qin Xue, Chen Tao, Lu Jin, Chao Zheng, and Wei Huang*,\nAdvanced Science, 5 (2018) 1800292\nhttp://doi.org/10.1002/advs.201800292\n[104] Realizing highly efficient solution-processed homojunction-like sky-blue OLEDs by using thermally activated delayed fluorescent emitters featuring aggregation-induced emission property\nKailong Wu, Zian Wang, Lisi Zhan, Cheng Zhong, Shaolong Gong, Guohua Xie*, and Chuluo Yang*\nThe Journal of Physical Chemistry Letters, 9 (2018) 1547-1553\nhttp://doi.org/10.1021/acs.jpclett.8b00344\n[103] Boosting the efficiency of near-infrared fluorescent OLED with an electroluminescent peak of nearly 800 nm by sensitizer-based cascade energy transfer\nTengxiao Liu, Guohua Xie*, Cheng Zhong, Shaolong Gong, and Chuluo Yang*\nAdvanced Functional Materials, 28 (2018) 1706088\nhttp://doi.org/10.1002/adfm.201706088\n[102] Using ring-opening metathesis polymerization of norbornene to construct thermally activated delayed fluorescence polymers: high-efficiency blue polymer light-emitting diodes\nXuan Zeng, Jiajia Luo, Tao Zhou, Tianheng Chen, Xiang Zhou, Kailong Wu, Yang Zou, Guohua Xie, Shaolong Gong, and Chuluo Yang*\nMacromolecules, 51 (2018) 1598-1604\nhttp://doi.org/10.1021/acs.macromol.7b02629\n[101] Linearly polarized electroluminescence from ionic iridium complex-based metallomesogens: the effect of aliphatic-chain on their photophysical properties\nXiugang Wu, Guohua Xie, Christopher P. Cabry, Xiaoyu Xu, Stephen Cowling, Duncan W. Bruce*, Weiguo Zhu, Etienne David Baranoff*, and Yafei Wang*\nJournal of Materials Chemistry C, 6 (2018) 3298-3309\nhttp://doi.org/10.1039/C7TC05421A\n[100] Carbazole-dendronized thermally activated delayed fluorescent molecules with small singlet-triplet gaps for solution-processed organic light-emitting diodes\nManli Huang, Yifan Li, Kailong Wu, Jiajia Luo, Guohua Xie*, Lu Li*, and Chuluo Yang*\nDyes and Pigments, 153 (2018) 92-98\nhttp://doi.org/10.1016/j.dyepig.2018.02.018\n[99] An efficient exciton harvest route for high-performance OLEDs based on aggregation-induced delayed fluorescence\nLing Yu, Zhongbin Wu, Guohua Xie, Cheng Zhong, Zece Zhu, Dongge Ma*, and Chuluo Yang*\nChemical Communications, 54 (2018) 1379-1382\nhttp://doi.org/10.1039/C7CC09925H\n[98] Highly efficient solution-processable nanophosphor with ambipolar shell\nChunmiao Han†, Guohua Xie†, and Hui Xu*\nChemistry - A European Journal, 24 (2018) 2971-2979\nhttp://doi.org/10.1002/chem.201705037\n(†Equal contribution)\n[97] Molecular design to regulate the photophysical properties of multifunctional TADF emitters towards high-performance TADF-based OLEDs with EQEs up to 22.4% and small efficiency roll-offs\nLing Yu, Zhongbin Wu, Guohua Xie, Weixuan Zeng, Dongge Ma*, and Chuluo Yang*\nChemical Science, 9 (2018) 1385-1391\nhttp://doi.org/10.1039/C7SC04669C\n[96] Achieving nearly 30% external quantum efficiency for orange-red organic light emitting diodes by employing thermally activated delayed fluorescence emitters composed of 1,8-naphthalimide-acridine hybrids\nWeixuan Zeng, Hsin-Yu Lai, Wei-Kai Lee, Min Jiao, Yi-Jiun Shiu, Cheng Zhong, Shaolong Gong*, Tao Zhou, Guohua Xie, Monima Sarma, Ken-Tsung Wong, Chung-Chih Wu*, and Chuluo Yang*\nAdvanced Materials, 30 (2018) 1704961\nhttp://doi.org/10.1002/adma.201704961\n[95] High-efficiency blue OLEDs based on dendritic dinuclear iridium (III) complexes grafted with fluorene core and blue fluorescence chromospheres\nYu Liu*, Zhaoran Hao, Haigang Jiang, Yajun Liu, Yafei Wang, Hua Tan, and Guohua Xie*\nTetrahedron, 74 (2018) 425-432\nhttp://doi.org/10.1016/j.tet.2017.12.018\n[94] New perylene diimide derivatives: stable red emission, adjustable property from ACQ to AIE, and good device performance with an EQE value of 4.93%\nLuyi Zong, Yanbin Gong, Yun Yu, Yujun Xie, Guohua Xie*, Qian Peng, Qianqian Li*, and Zhen Li*\nScience Bulletin, 63 (2018) 108-116\nhttp://doi.org/10.1016/j.scib.2017.10.021\n2017\n[93] Pyrene-based blue AIEgen: enhanced hole mobility and good EL performance in solution-processed OLEDs\nJie Yang, Jianwen Qin, Zichun Ren, Qian Peng, Guohua Xie*, and Zhen Li*\nMolecules, 22 (2017) 2144\nhttp://doi.org/10.3390/molecules22122144\n[92] Pure organic emitter with simultaneous thermally activated delayed fluorescence and room-temperature phosphorescence: thermal-controlled triplet recycling channels\nLing Yu, Zhongbin Wu, Cheng Zhong, Guohua Xie, Zece Zhu, Dongge Ma*, and Chuluo Yang*\nAdvanced Optical Materials, 5 (2017) 1700588\nhttp://doi.org/10.1002/adom.201700588\n[91] Halogen-induced internal heavy-atom effect shortening emissive lifetime and improving fluorescence efficiency of thermally activated delayed fluorescence emitters\nYepeng Xiang, Yongbiao Zhao, Nan Xu, Shaolong Gong*, Fan Ni, Kailong Wu, Jiajia Luo, Guohua Xie, Zheng-Hong Lu*, and Chuluo Yang*\nJournal of Materials Chemistry C, 5 (2017) 12204-12210\nhttp://doi.org/10.1039/C7TC04181K\n[90] Near-infrared emission of dinuclear iridium complexes with hole/electron transporting bridging and their monomer in solution-processed organic light-emitting diodes\nZhaoran Hao, Min Li, Yajun Liu, Yafei Wang, Guohua Xie*, and Yu Liu*\nDyes and Pigments, 149 (2017) 315-322\nhttp://doi.org/10.1016/j.dyepig.2017.09.061\n[89] Bright white electroluminescence from a single polymer containing thermally activated delayed fluorescence unit and solution-processed orange OLED of approaching 20% external quantum efficiency\nYanjie Wang, Yunhui Zhu, Guohua Xie*, Hongmei Zhan, Chuluo Yang, and Yanxiang Cheng*\nJournal of Materials Chemistry C, 5 (2017) 10715-10720\nhttp://doi.org/10.1039/C7TC03769D\n[88] Highly efficient solution-processed deep-red organic light-emitting diodes based on an exciplex host composed of a hole transporter and a bipolar host\nManli Huang, Bei Jiang, Guohua Xie*, and Chuluo Yang*\nThe Journal of Physical Chemistry Letters, 8 (2017) 4967-4973\nhttp://doi.org/10.1021/acs.jpclett.7b02326\n[87] Simple InCl3 doped PEDOT:PSS and UV-ozone treatment strategy: external quantum efficiency up to 21% for solution-processed organic light-emitting devices with a thermally activated delayed fluorescence emitter\nTao Zhou, Guohua Xie*, Shaolong Gong, Manli Huang, Jiajia Luo, and Chuluo Yang*\nACS Applied Materials and Interfaces, 9 (2017) 34139-34145\nhttp://doi.org/10.1021/acsami.7b09644\n[86] Rational design of isophthalonitrile-based thermally activated fluorescence emitters for OLEDs with high efficiency and slow efficiency roll-off\nJiajia Luo, Shaolong Gong, Tao Zhang, Cheng Zhong, Guohua Xie, Zheng-Hong Lu*, and Chuluo Yang*\nDyes and Pigments, 147 (2017) 350-356\nhttp://doi.org/10.1016/j.dyepig.2017.08.030\n[85] White electroluminescent phosphine-chelated copper iodide nanoclusters\nMingchen Xie, Chunmiao Han, Jing Zhang, Guohua Xie*, and Hui Xu*\nChemistry of Materials, 29 (2017) 6606-6610\nhttp://doi.org/10.1021/acs.chemmater.7b01443\n[84] A red fluorescent emitter with a simultaneous hybrid local and charge transfer excited state and aggregation-induced emission for high-efficiency, low efficiency roll-off OLEDs\nTengxiao Liu, Liping Zhu, Shaolong Gong, Cheng Zhong, Guohua Xie, Erqian Mao, Junfeng Fang, Dongge Ma*, and Chuluo Yang*\nAdvanced Optical Materials, 5 (2017) 1700145\nhttp://doi.org/10.1002/adom.201700145\n[83] Self-doping cathode interfacial materials simultaneously enabling high electron mobility and powerful work function tunability for high-efficiency all-solution-processed polymer light-emitting diodes\nXiaojun Yin†, Guohua Xie†, Yuhao Peng, Bowen Wang, Tianhao Chen, Shuqi Li, Wenhao Zhang, Lei Wang*, and Chuluo Yang*\nAdvanced Functional Materials, 27 (2017) 1700695\nhttp://doi.org/10.1002/adfm.201700695\n(†Equal contribution)\nSelected as Back Cover: http://doi.org/10.1002/adfm.201770160\n[82] Spirotriphenylamine based star-shaped D-A molecules meeting AIE chromophore for both efficient solution-processed doped and nondoped blue organic light-emitting diodes\nYafei Wang*, Wanhui Liu, Zuoming Qu, Hua Tan, Yu Liu, Guohua Xie*, and Weiguo Zhu\nDyes and Pigments, 143 (2017) 173-182\nhttp://doi.org/10.1016/j.dyepig.2017.04.030\n[81] Carbazole/oligofluorene end-capped hexanes: solution-processable host materials for phosphorescent organic light-emitting diodes\nHuanhuan Li, Ye Tao, Runfeng Chen*, Guohua Xie*, Chao Zheng, and Wei Huang*\nJournal of Materials Chemistry C, 5 (2017) 4442-4447\nhttp://doi.org/10.1039/C7TC00103G\n[80] Highly efficient blueish-green fluorescent OLEDs based on AIE liquid crystal molecules: from ingenious molecular design to multifunction material\nYafei Wang*, Yuanwei Liao, Christopher P. Cabry, Di Zhou, Guohua Xie*, Zuoming Qu, Duncan W. Bruce*, and Weiguo Zhu*\nJournal of Materials Chemistry C, 5 (2017) 3999-4008\nhttp://doi.org/10.1039/C7TC00034K\n[79] Tuning the twist angle of thermally activated delayed fluorescence molecules via dendronization strategy: high-efficiency solution-processed non-doped OLEDs\nYifan Li, Tianheng Chen, Manli Huang, Yu Gu, Shaolong Gong, Guohua Xie, and Chuoluo Yang*\nJournal of Materials Chemistry C, 5 (2017) 3480-3487\nhttp://doi.org/10.1039/C7TC00119C\n[78] Tuning the emission from local excited-state to charge-transfer state transition in quinoxaline-based butterfly-shaped molecules: Efficient orange OLEDs based on thermally activated delayed fluorescence emitter\nLing Yu, Zhongbin Wu, Cheng Zhong, Guohua Xie, Kailong Wu, Dongge Ma*, and Chuluo Yang*\nDyes and Pigments, 141 (2017) 325-332\nhttp://doi.org/10.1016/j.dyepig.2017.02.035\n[77] Iridium-based emitters containing pendant triphenylene moieties for bluish-green OLEDs with improved efficiency upon thermal annealing\nYafei Wang*, Mengbing Zhu, Jiyong Deng, Guohua Xie*, Etienne Baranoff*\nNew Journal of Chemistry, 41 (2017) 1773-1780\nhttp://doi.org/10.1039/c6nj03692a\n[76] Naphthothiadiazole-based near-infrared emitter with a photoluminescence quantum yield of 60% in neat film and external quantum efficiencies of up to 3.9% in nondoped OLEDs\nTengxiao Liu, Liping Zhu, Cheng Zhong, Guohua Xie, Shaolong Gong, Junfeng Fang, Dongge Ma*, and Chuluo Yang*\nAdvanced Functional Materials, 27 (2017) 1606384\nhttp://doi.org/10.1002/adfm.201606384\n[75] Tuning emissive characteristics and singlet-triplet energy splitting of fluorescent emitters by encapsulation group modification: Yellow TADF emitter for solution-processed OLEDs with high luminance and ultraslow efficiency roll-off\nShaolong Gong, Jiajia Luo, Zian Wang, Yifan Li, Tianheng Chen, Guohua Xie, and Chuluo Yang*\nDyes and Pigments, 139 (2017) 593-600\nhttp://doi.org/10.1016/j.dyepig.2016.12.058\n[74] Inheriting the characteristics of TADF small-molecule by side-chain engineering strategy to enable bluish-green polymers with high PLQYs up to 74% and external quantum efficiency over 16% in light-emitting diodes\nGuohua Xie†, Jiajia Luo†, Manli Huang, Tianheng Chen, Kailong Wu, Shaolong Gong, and Chuluo Yang*\nAdvanced Materials, 29 (2017) 1604223\n(†Equal contribution)\nhttp://doi.org/10.1002/adma.201604223\n2016\n[73] Synthesis of solution processable blue AIEgens and the device performance\nYun Yu, Jie Yang, Zichun Ren, Guohua Xie*, Qianqian Li, and Zhen Li*\nActa Chimica Sinica, 74 (2016) 865-870\nhttp://doi.org/10.6023/A16070372\n[72] Triazine-core-containing star-shape compounds as cathode interlayers for efficient inverted polymer solar cells\nYuan Liu, Wenjun Zhang, Guohua Xie, Xuan Zeng, Junfeng Fang*, and Chuluo Yang*\nJournal of Materials Chemistry C, 4 (2016) 11278-11283\nhttp://doi.org/10.1039/C6TC03948K\n[71] Controlling the emission efficiency of blue-green iridium(III) phosphorescent emitters and applications in solution-processed organic light-emitting diodes\nMuhammad T. Sajjad, Nidhi Sharma, Amlan K. Pal, Kamrul Hasan, Guohua Xie, Lisa S. Koelln, Garry S. Hanan*, Ifor D. W. Samuel*, and Eli Zysman-Colman*\nJournal of Materials Chemistry C, 4 (2016) 8939-8946\nhttp://doi.org/10.1039/C6TC02909D\n[70] Achieving a balance between small singlet-triplet energy splitting and high fluorescence radiative rate in quinoxaline-based orgage-red thermally activated delayed fluorescence emitter\nLing Yu, Zhongbin Wu, Guohua Xie, Cheng Zhong, Zece Zhu, Hengjiang Cong, Dongge Ma*, and Chuluo Yang*\nChemical Communications, 52 (2016) 11012-11015\nhttp://doi.org/10.1039/C6CC05203G\n[69] Engineering the interconnection position of star-shaped D-π –A molecules based on triazine, spirofluorene and triphenylamine moieties for color tuning from deep blue to green\nYafei Wang*, Wanhui Liu, Jiyong Deng, Guohua Xie*, Yuanwei Liao, Zuoming Qu, Hua Tan, Yu Liu, and Weiguo Zhu\nChemistry - An Asian Journal, 11 (2016) 2555-2563\nhttp://doi.org/10.1002/asia.201600727\n[68] Simple pyridinehydrochlorides as bifunctional electron injection and transport materials forhigh-performance all-solution-processed organic light emitting diodes\nXiaojun Yin†, Guohua Xie†, Tao Zhou, Yepeng Xiang, Kailong Wu, Jingui Qin and Chuluo Yang*\nJournal of Materials Chemistry C, 4 (2016) 6224-6229\n(†Equal contribution)\nhttp://doi.org/10.1039/C6TC01647B\n[67] Influence of integrated alkyl-chain length on the mesogenic and photophysical properties of platinum-basedmetallomesogens and their application for polarized white OLEDs\nYafeiWang*, Jiang Fan, Junwei Shi, Hongrui Qi, Etienne Baranoff, GuohuaXie*, Qingguo Li, Hua Tan, Yu Liu, and Weiguo Zhu*\nDyes and Pigments, (2016), 133 (2016) 238-247\nhttp://doi.org/10.1016/j.dyepig.2016.05.024\n[66] Boosting reverse intersystem crossing by increasing donors in triarylboron/phenoxazine hybrids: thermally activated delayed fluorescence emitters for high-performances solution-processed organic light-emitting diodes\nYuan Liu, Guohua Xie, Kailong Wu, Zhenghui Luo, Tao Zhou, Xuan Zeng, Jie Yu, Shaolong Gong, and Chuluo Yang*\nJournal of Materials Chemistry C, 4 (2016) 4402-4407\nhttp://doi.org/10.1039/C6TC01353H\n[65] Dendronized delayed fluorescence emitters for non-doped, solution-processed organic light-emitting diodes with high efficiency and low efficiency roll-off simultaneously: two parallel emissive channels\nYifan Li†, Guohua Xie†, Shaolong Gong, Kailong Wu, and Chuluo Yang*\nChemical Science, 7 (2016) 5441-5447\n(†Equal contribution)\nhttp://doi.org/10.1039/C6SC00943C\n[64] Solution-processable silicon phthalocyanines in electroluminescent and photovoltaic devices\nEli Zysman-Colman*, Sanjay Sanatan Ghosh, Guohua Xie, Shinto Varghese, Mithun Chowdhury, Nidhi Sharma, David B. Cordes, Alexandra M. Z. Slawin, and Ifor Samuel*\nACS Applied Materials and Interfaces 8 (2016) 9247-9253\nhttp://doi.org/10.1021/acsami.5b12408\n[63] Deep-red iridium(III) complexes cyclometalated by phenanthridine derivatives for highly efficient solution-processed organic light-emitting diodes\nBei Jiang, Yu Gu, Jingjing Qin, Xiaowen Ning, Shaolong Gong, Guohua Xie, and Chuluo Yang*\nJournal of Materials Chemistry C, 4 (2016) 3492-3498\nhttp://doi.org/10.1039/C6TC00148C\n[62] Multi-carbazole encapsulation as a simple strategy for constructing solution-processed, non-doped thermally activated delayed fluorescent emitters\nJiajia Luo, Shaolong Gong, Yu Gu, Tianheng Chen, Yifan Li, Cheng Zhong, Guohua Xie, and Chuluo Yang*\nJournal of Materials Chemistry C, 4 (2016) 2442-2446\nhttp://doi.org/10.1039/C6TC00418K\n[61] The end-capped group effect on dithienosilole trimer based small molecules for efficient organic photovoltaics\nWei Li, Wanyuan Deng, Kailong Wu, Guohua Xie, Chuluo Yang*, Hongbin Wu*, and Yong Cao\nJournal of Materials Chemistry C, 4 (2016) 1972-1978\nhttp://doi.org/10.1039/C6TC00164E\n[60] Rational utilization of intramolecular and intermolecular hydrogen bonds to achieve desirable electron transporting materials with high mobility and high triplet energy\nXiaojun Yin, Dongcheng Chen, Qiming Peng, Yepeng Xiang, Guohua Xie, Zece Zhu, Cheng Zhong, Feng Li*, Shijian Su*, and Chuluo Yang*\nJournal of Materials Chemistry C, 4 (2016) 1482-1489\nhttp://doi.org/10.1039/C5TC04198H\n[59] Creating a thermally activated delayed fluorescence channel in a single polymer system to enhance exciton utilization efficiency for bluish-green electroluminescence\nJiajia Luo†, Guohua Xie†, Shaolong Gong†, Tianheng Chen, and Chuluo Yang*\nChemical Communications, 52 (2016) 2292-2295\n(†Equal contribution)\nhttp://doi.org/10.1039/C5CC09797E\n[58] Improved performance of inverted polymer solar cells by utilizing alcohol-soluble oligofluorenes as efficient cathode interlayers\nYuan Liu, Wenjun Zhang, Yang Zou, Guohua Xie, Junfeng Fang*, and Chuluo Yang*\nOrganic Electronics, 30 (2016) 182-190\nhttp://doi.org/10.1016/j.orgel.2015.12.025\n[57] Measuring and structuring the spatial coherence length of organic light-emitting diodes\nGuohua Xie, Mingzhou Chen, Michael Mazilu, Shuyu Zhang, A. K. Bansal, Kishan Dholakia, and Ifor D. W. Samuel*\nLaser and Photonics Reviews, 10 (2016) 82-90\nhttp://doi.org/10.1002/lpor.201500065\n2015\n[56] Dithieno [3, 2-b: 2′, 3′-d] pyridin-5 (4 H)-one-based polymers with a bandgap up to 2.02 eV for high performance field-effect transistors and polymer solar cells with an open-circuit voltage up to 0.98 V and an efficiency up to 6.84%\nMinghui Hao, Guoping Luo, Keli Shi, Guohua Xie, Kailong Wu, Hongbin Wu*, Gui Yu*, Yong Cao, and Chuluo Yang*\nJournal of Materials Chemistry A, 3 (2015) 20516-20526\nhttp://doi.org/10.1039/C5TA06111C\n[55] Light-emitting electrochemical cells and solution-processed organic light-emitting diodes using small molecule organic thermally activated delayed fluorescence emitters\nMichael Y. Wong, Gordon J. Hedley, Guohua Xie, Lisa S. Kölln, Ifor D. W. Samuel, Antonio Pertegás, Henk J. Bolink, and Eli Zysman-Colman*\nChemistry of Materials, 27 (2015) 6535-6542\nhttp://doi.org/10.1021/acs.chemmater.5b03245\n[54] Green phosphorescence and electroluminescence of sulfur pentafluoride-functionalized cationic iridium(III) complexes\nNail M. Shavaleev, Guohua Xie, Shinto Varghese, David B. Cordes, Alexandra M. Z. Slawin, Cristina Momblona, Enrique Ortí, Henk J. Bolink, Ifor D. W. Samuel*, and Eli Zysman-Colman*\nInorganic Chemistry, 54 (2015) 5907-5914\nhttp://doi.org/10.1021/acs.inorgchem.5b00717\n[53] Benzobisoxazole-based electron transporting materials with high Tg and ambipolar property: high efficiency deep-red phosphorescent OLEDs\nXiaojun Yin, Tingke Zhang, Qiming Pei, Tao Zhou, Weixuan Zeng, Zece Zhu, Guohua Xie, Feng Li, Dongge Ma*, and Chuoluo Yang*\nJournal of Materials Chemistry C, 3 (2015) 7589-7596\nhttp://doi.org/10.1039/C5TC01353D\n[52] Benzo[1,2‑b:4,5‑b′]dithiophene and thieno[3,4‑c]pyrrole-4,6-dione based donor-π-acceptor conjugated polymers for high performance solar cells by rational structure modulation\nShu Liu, Xichang Bao, Wei Li, Kailong Wu, Guohua Xie, Renqiang Yang*, and Chuluo Yang*\nMacromolecules, 48 (2015) 2948-2957\nhttp://doi.org/10.1021/acs.macromol.5b00251\n[51] Formylated chloro-bridged iridium(III) dimers as OLED materials: opening up new possibilities\nMichael Y. Wong, Guohua Xie, Clarisse Tourbillon, Martina Sandroni, David B. Cordes, Alexandra M. Z. Slawin, Ifor D. W. Samuel, and Eli Zysman-Colman*\nDalton Transactions, 44 (2015) 8419-8432\nhttp://doi.org/10.1039/C4DT03127J\n[50] A Unique white electrolulminescent one-dimensional europium(III) coordination polymer\nHui Xu*, Jianzhe Wang, Ying Wei, Guohua Xie*, Qin Xue, Zhaopeng Deng, and Wei Huang*\nJournal of Materials Chemistry C, 3 (2015) 1893-1903\nhttp://doi.org/10.1039/C4TC02604G\n2014\n[49] Solution processible brilliantly luminescent EuIII complexes with host-featured phosphoine oxide ligands for monochromic red light-emittng diodes\nJianzhe Wang, Chunmiao Han, Guohua Xie*, Ying Wei*, Qin Xue, Pengfei Yan, and Hui Xu*\nChemistry - A European Journal, 20 (2014) 11137-11148\nhttp://doi.org/10.1002/chem.201403244\n[48] P-I-N-P top-emittig organic light-emitting diodes with MoOx as the electrical and optical modification layers\nGuohua Xie*, Karsten Fehse, Karl Leo, and Malte Gather*\nPhysica Status Solidi (a), 211 (2014) 1168-1174\nhttp://doi.org/10.1002/pssa.201330527\n[47] Distinguishing triplet energy transfer and trap-assisted recombination in multi-color organic light-emitting diode with an ultrathin phosphorescent emissivelayer\nQin Xue*, Guohua Xie, Shouyin Liu, Ping Chen, Yi Zhao, and Shiyong Liu\nJournal of Applied Physics, 115 (2014) 114504\nhttp://doi.org/10.1063/1.4869056\n[46] Highly efficient and color-stable white organic light-emitting diode based on a novel blue phosphorescent host\nQingyang Wu, Yu Chen, Guohua Xie, Mingzhu Wu, Yukun Wu, Changhua Gou, Xiaoliang Guan, Zhensong Zhang, Shouzhen Yue, Pingrui Yan, Dalong Qu, Chong Cao, and Yi Zhao*\nSynthetic Metals, 187 (2014) 160-164\nhttp://doi.org/10.1016/j.synthmet.2013.11.010\n2013\n[45] Novel P-I-N-P top-emitting organic light-emitting diodes with enhanced efficiency and stability\nGuohua Xie*, Karsten Fehse, Karl Leo, and Malte C. Gather*\nOrganic Electronics, 14 (2013) 2331-2340\nhttp://doi.org/10.1016/j.orgel.2013.05.034\n[44] Understanding the influence of doping in efficient phosphorescent organic light-emitting diodes with an organic p-i-n homojunction\nChanghun Yun*, Guohua Xie, Caroline Murawski, Jonghee Lee, Fabian Ventsch, Karl Leo, and Malte C. Gather\nOrganic Electronics, 14 (2013) 1695-1703\nhttp://doi.org/10.1016/j.orgel.2013.04.018\n[43] A bulky pyridinylfluorene-functionalizing approach to synthesize diarylfluorene-based bipolar host materials for efficient red, green, blue and white electrophorescent devices\nXiang-Hua Zhao, Zhen-Song Zhang, Yan Qian, Ming-Dong Yi, Ling-Hai Xie*, Chao-Peng Hu, Guo-Hua Xie, Hui Xu, Chun-Miao Han, Yi Zhao*, and Wei Huang*\nJournal of Materials Chemistry C, 21 (2013) 3482-3490\nhttp://doi.org/10.1039/C3TC00875D\n[42] Hybrid white organic light-emitting diodes with improved color stability and negligible efficiency roll-off based on blue fluorescence and yellow phosphorescence\nXuehui Wang, Shiming Zhang, Ziyang Liu, Shouzhen Yue, Zhensong Zhang, Yu Chen, Guohua Xie, Qin Xue, Yi Zhao*, and Shiyong Liu\nJournal of Luminescence, 137 (2013) 59-63\nhttp://doi.org/10.1016/j.jlumin.2012.12.031\n[41] Enhanced efficiency in single-host white organic light-emitting diode by triplet exciton conversion\nQingyang Wu*, Shiming Zhang, Shouzhen Yue, Zhensong Zhang, Guohua Xie, Yi Zhao* and Shiyong Liu\nJournal of Luminescence, 143 (2013) 108-112\nhttp://doi.org/10.1016/j.jlumin.2013.04.037\n[40] Convergent modulation of singlet and triplet excited states of phosphine-oxide hosts through the management of molecular structure and functional-group linkages for low-voltage-driven electrophorescence\nChunmiao Han, Zhensong Zhang, Hui Xu*, Guohua Xie, Jing Li, Yi Zhao*, Zhaopeng Deng, Shiyong Liu and Pengfei Yan\nChemistry- A European Journal, 19 (2013) 141-154\nhttp://doi.org/10.1002/chem.201203349\n[39] Color stable multilayer all-phosphor white organic light-emitting diodes with excellent color quality\nShiming Zhang*, Shouzhen Yue, Qingyang Wu, Zhensong Zhang, Yu Chen, Xuehui Wang, Ziyang Liu, Guohua Xie, Qin Xue, Dalong Qu, Yi Zhao*, and Shiyong Liu\nOrganic Electronics, 14 (2013) 2014-2022\nhttp://doi.org/10.1016/j.orgel.2013.04.039\n[38] High performance top-emitting and transparent white organic light-emitting diodes based on Al/Cu/TcTa transparent electrodes for active matrix displays and lighting applications\nZhensong Zhang, Pingrui Yan, Shouzhen Yue, Guohua Xie, Yu Chen, Qingyang Wu, Dalong Qu, Yi Zhao*, and Shiyong Liu\nOrganic Electronics, 14 (2013) 1452-1457\nhttp://doi.org/10.1016/j.orgel.2013.03.007\n[37] White organic light-emitting diodes based on a yellow phosphorescence iridium complex and a high-efficiency blue fluorescence\nShiming Zhang, Ziyang Liu, Xuehui Wang, Shouzhen Yue, Zhensong Zhang, Qingyang Wu, Guohua Xie, Qin Xue, Yu Chen, Peng Wang, Runda Guo, Dalong Qu, Yi Zhao*, and Shiyong Liu\nThin Solid Films, 537 (2013) 221-225\nhttp://doi.org/10.1016/j.tsf.2013.04.036\n[36] Stable and water-soluble CdTe@SiO2 composite nanospheres: Preparations, characterization and application in LED\nDi Li*, Xiaoming Liu, Guohua Xie, and Xueyan Liu\nColloids and Surfaces A: Physicochemical and Engineering Aspects, 424 (2013) 33-39\nhttp://doi.org/10.1016/j.colsurfa.2013.02.027\n[35] Diarylfluorenes-based pi-stacked molecules: synthesis, X-ray crystallography, and supramolecular light-emitting devices\nYang Yang, Jian-Feng Zhao, Ran-Ran Liu, Jie-Wei Li, Ming-Dong Yi, Guo-Hua Xie, Ling-Hai Xie*, Yong-Zheng Chang, Cheng-Rong Yin, Xin-Hui Zhou, Yi Zhou, Yan Qian, and Wei Huang*\nTetrahedron, 69 (2013) 6317-6322\nhttp://doi.org/10.1016/j.tet.2013.02.090\n2012\n[34] Color stable and low driving voltage white organic light-emitting diodes with low efficiency roll-off achieved by selective hole transport buffer layers\nZhensong Zhang, Guohua Xie, Shouzhen Yue, Qingyang Wu, Yu Chen, Shiming Zhang, Li Zhao, Yang Luo, Yi Zhao* and Shiyong Liu\nOrganic Electronics, 13 (2012) 2296-2300\nhttp://doi.org/10.1016/j.orgel.2012.07.001\n[33] Influence of molecular configuration and functional substituents on excited state energy levels in two naphthyl-based phosphine oxide hosts\nHui Xu*, Guohua Xie, Chunmiao Han, Zhensong Zhang, Zhaopeng Deng, Yi Zhao*, Pengfei Yan, and Shiyong Liu\nOrganic Electronics, 13 (2012) 1516-1525\nhttp://doi.org/10.1016/j.orgel.2012.05.003\n[32] Controllably Tuning Excited-State Energy in Ternary Hosts for Ultralow-Voltage-Driven Blue Electrophosphorescence\nChunmiao Han, Zhensong Zhang, Hui Xu*, Jing Li, Guohua Xie, Runfeng Chen, Yi Zhao*, and Wei Huang\nAngewandte Chemie International Edition, 51 (2012) 10104-10108\nhttp://doi.org/10.1002/anie.201202702\n[31] A new spiro[fluorine-9,9´-xanthene]-based host material possessing no conventional hole- and electron-transporting units for efficient and low voltage blue PHOLED via simple two-step synthesis\nYan Qian, Guohua Xie, Shufen Chen, Zhengdong Liu, Yeren Ni, Xinhui Zhou, Linghai Xie*, Jing Liang, Yuezhi Zhao, Minghong Yi, Yi Zhao*, Wei Wei, and Wei Huang*\nOrganic Electronics, 13 (2012) 2741-2746\nhttp://doi.org/10.1016/j.orgel.2012.07.047\n[30] A 3-dimensional spiro-functionalized platinum(II) complex to suppress intermolecular π-π and PtPt supromolecular interactions for a high-performance electrophosphorescent device\nXiang-Hua Zhao, Guo-Hua Xie, Zheng-Dong Liu, Wei-Jie Li, Ming-dong Yi, Ling-Hai Xie*, Chao-Peng Hu, Rui Zhu, Qiang Zhao, Yi Zhao, Jian-Feng Zhao, Yan Qian, and Wei Huang*\nChemical Communications, 48 (2012) 3854-3856\nhttp://doi.org/10.1039/C2CC30595J\n[29] A new OLED SPICE model for pixel circuit simulation in OLED-on-silicon microdisplay design\nBohua Zhao, Ran Huang, Jianhui Bu, Yinxue Lv, Yiqi Wang, Fei Ma, Guohua Xie, Zhensong Zhang, Huan Du, Jiajun Luo, Zhengsheng Han*, and Yi Zhao\nJournal of Semiconductors, 33 (2012) 075007\nhttp://doi.org/10.1088/1674-4926/33/7/075007\n[28] The realization of an SVGA OLED-on-silicon microdisplay driving circuit\nBohua Zhao*, Ran Huang, Fei Ma, Guohua Xie, Zhengsong Zhang, Huan Du, Jiajun Luo, Yi Zhao\nJournal of Semiconductors, 33 (2012) 035006\nhttp://doi.org/10.1088/1674-4926/33/3/035006\n[27] Xanthene-based phosphine oxide host with the planar multi-insulating structure for efficient electrophosphorescence\nChunmiao Han, Guohua Xie, Hui Xu*, Zhensong Zhang, Pengfei Yan, Yi Zhao*, and Shiyong Liu\nDyes and Pigments, 94 (2012) 561-569\nhttp://doi.org/10.1016/j.dyepig.2012.03.013\n[26] All fluorescent and high color rendering index white organic light-emitting devices with improved color stability at high brightness\nShiming Zhang, Guohua Xie, Qin Xue, Zhensong Zhang, Li Zhao, Yang Luo, Shouzhen Yue, Yi Zhao*, and Shiyong Liu\nThin Solid Films, 520 (2012) 2966-2970\nhttp://doi.org/10.1016/j.tsf.2011.10.148\n2011\n[25] Tailoring the efficiencies and spectra of white organic light-emitting diodes with the interlayers\nGuohua Xie, Zhensong Zhang, Qin Xue, Shiming Zhang, Yang Luo, Li Zhao, Ping Chen, Baofu Quan, Yi Zhao*, and Shiyong Liu*\nThe Journal of Physical Chemistry C, 115 (2011) 264-269\nhttp://doi.org/10.1021/jp107319e\n[24] A single phosphine oxide host for high-efficiency white organic light-emitting diodes with extremely low operating voltages and reduced efficiency roll-off\nChunmiao Han†, Guohua Xie†, Hui Xu*, Zhensong Zhang, Linghai Xie, Yi Zhao*, Shiyong Liu, and Wei Huang\nAdvanced Materials, 23 (2011) 2491-2496\n(†Equal contribution)\nhttp://doi.org/10.1002/adma.201100322\nThis paper has been one of Organic Electronics: Wiley-VCH Hot Topics in July, 2011.\n[23] Towards highly efficient blue-phosphorescent organic light-emitting diodes with low operating voltage and excellent efficiency stability\nChunmiao Han, Guohua Xie, Hui Xu*, Zhensong Zhang, Donghui Yu, Yi Zhao*, Pengfei Yan, Qiang Li, and Shiyong Liu\nChemistry - A European Journal, 17 (2011) 445-449\nhttp://doi.org/10.1002/chem.201001981\n[22] Harmonizing triplet level and ambipolar characteristics of wide-gap phosphine oxide hosts toward highly efficient and low diving voltage blue and green PHOLEDS\nJie Zhao†, Guo-Hua Xie†, Cheng-Rong Yin, Ling-Hai Xie, Chun-Miao Han, Run-Feng Chen, Hui Xu*, Ming-Dong Yi, Zhao-Peng Deng, Shu-Fen Chen, Yi Zhao*, Shi-Yong Liu, and Wei Huang*\nChemistry of Materials, 23 (2011) 5331-5339\n(†Equal contribution)\nhttp://doi.org/10.1021/cm201654c\n[21] Conjugated asymmetric donor-substituted 1,3,5-triazines: new host materials for blue phosphorescent organic light-emitting diodes\nZhong-Fu An, Run-Feng Chen*, Jun Yin, Guo-Hua Xie, Hui-Fang Shi, Taiju Tsuboi, and Wei Huang*\nChemistry - A European Journal, 17 (2011) 10871-10878\nhttp://doi.org/10.1002/chem.201101118\nThis is a paper of Cover Picture in Volume 17, Issue 39, September 19th, 2011\n[20] A new phosphine oxide host based on ortho-disubstituted dibenzofuran for efficient electrophosphorescence: towards high triplet state excited levels and excellent thermal, morphological and efficiency stability\nChunmiao Han†, Guohua Xie†, Jing Li, Zhengsong Zhang, Hui Xu*, Zhaopeng Deng, Yi Zhao*, Pengfei Yan, and Shiyong Liu\nChemistry – A European Journal, 17 (2011) 8947-8956\n(†Equal contribution)\nhttp://doi.org/10.1002/chem.201100695\n[19] Novel heterofluorene-based hosts for highly efficient blue electrophosphorescence at low operating voltages\nRun-Feng Chen, Guo-Hua Xie, Yi Zhao*, Sheng-Lan Zhang, Jun Yin, Shi-Yong Liu, and Wei Huang*\nOrganic Electronics, 12 (2011) 1619-1624\nhttp://doi.org/10.1016/j.orgel.2011.05.025\n[18] Tailoring Spatial Distribution of the Optical Field Intensity in Semitransparent Inverted Organic Solar Cells\nChen Tao*, Guohua Xie, Fanxu Meng, Shengping Ruan*, and Weiyou Chen\nThe Journal of Physical Chemistry C, 115 (2011) 12611-12615\nhttp://doi.org/10.1021/jp201890q\n[17] Efficient white organic light-emitting diodes based on an orange iridium phosphorescent complex\nPing Chen*, Li Zhao, Yu Duan, Yi Zhao, Wenfa Xie, Guohua Xie, Shiyong Liu*, Liying Zhang, and Bin Li\nJournal of Luminescence, 131 (2011) 2144-2147\nhttp://doi.org/10.1016/j.jlumin.2011.05.038\n[16] Combination of heterojunction and mixed-host structures in one blue fluorescent organic light emitting diode to improve the power efficiency\nQin Xue, Shiming Zhang, Guohua Xie, Zhensong Zhang, Yang Luo, Li Zhao, Ping Chen, Yi Zhao*, and Shiyong Liu\nThin Solid Films, 519 (2011) 3816-3818\nhttp://doi.org/10.1016/j.tsf.2011.01.189\n[15] Efficient fluorescent white organic light-emitting devices based on a ultrathin 5,6,11,12-tetraphenylnaphthacene layer\nQin Xue, Shiming Zhang, Guohua Xie, Zhensong Zhang, Li Zhao, Yang Luo, Ping Chen, Yi Zhao*, and Shiyong Liu*\nSolid-State Electronics, 57 (2011) 35-38\nhttp://doi.org/10.1016/j.sse.2010.11.020\n2010\n[14] Highly efficient and low-cost top-emitting organic light-emitting diodes for monochromatic microdisplays\nGuohua Xie, Qin Xue, Ping Chen, Chen Tao, Chunmei Zhao, Jianhua Lu, Zhaoxin Gong, Tianyu Zhang, Ran Huang, Huan Du, Wenfa Xie, Jingying Hou, Yi Zhao*, and Shiyong Liu*\nOrganic Electronics, 11 (2010) 407-411\nhttp://doi.org/10.1016/j.orgel.2009.11.019\n[13] Highly efficient top-emitting white organic light-emitting diodes with improved contrast and reduced angular dependence for active matrix displays\nGuohua Xie, Zhensong Zhang, Qin Xue, Shiming Zhang, Li Zhao, Yang Luo, Ping Chen, Baofu Quan, Yi Zhao*, and Shiyong Liu*\nOrganic Electronics, 11 (2010) 2055-2059\nhttp://doi.org/10.1016/j.orgel.2010.10.001\n[12] Dumbbell-shaped spirocyclic aromatic hydrocarbon to control intermolecular π-π stacking interaction for high-performance nondoped deep-blue organic light-emitting devices\nJu-Fen Gu, Guo-Hua Xie, Long Zhang, Shu-Fen Chen, Zong-Qiong Lin, Zhen-Song, Zhang, Jian-Feng Zhao, Ling-Hai Xie*, Chao Tang, Yi Zhao*, Shi-Yong Liu, and Wei Huang*\nThe Journal of Physical Chemistry Letters, 1 (2010) 2849-2853\nhttp://doi.org/10.1021/jz101039d\n[11] White organic light-emitting devices with a bipolar transport layer between blue fluorescent and yellow-phosphor-sensitized-fluorescent emitting layers\nQin Xue, Guohua Xie, Ping Chen, Jianhua Lu, Dandan Zhang, Yanna Tang, Yi Zhao*, Jingying Hou, and Shiyong Liu\nSynthetic Metals, 160 (2010) 829-831\nhttp://doi.org/10.1016/j.synthmet.2009.12.011\n2009\n[10] Semitransparent inverted polymer solar cells with MoO3/Ag/MoO3 as transparent electrode\nChen Tao*, Guohua Xie, Caixia Liu, Xindong Zhang, Wei Dong, Fanxu Meng, Xiangzi Kong, Liang Shen, Shengping Ruan*, and Weiyou Chen\nApplied Physics Letters, 95 (2009) 053303\nhttp://doi.org/10.1063/1.3196763\nThis paper has been one of the TOP 20 Most Downloaded Articles in Applied Physics Letters—August 2009\n[9] Role of tungsten oxide in inverted polymer solar cells\nChen Tao, Shengping Ruan, Guohua Xie, Xiangzi Kong, Liang Shen, Fanxu Meng, Caixia Liu, Xindong Zhang, Wei Dong*, and Weiyou Chen\nApplied Physics Letters, 94 (2009) 043311\nhttp://doi.org/10.1063/1.3076134\n[8] Enhanced hole injection in organic light-emitting devices by using Fe3O4 as an anodic buffer layer\nDan-Dan Zhang, Jing Feng*, Yue-Feng Liu, Yu-Qing Zhong, Yu Bai, Yu Jin, Guo-Hua Xie, Qin Xue, Yi Zhao, Shi-Yong Liu, and Hong-Bo Sun*\nApplied Physics Letters, 94 (2009) 223306\nhttp://doi.org/10.1063/1.3148657\n[7] Influence of interlayer on the performance of stacked white organic light-emitting devices\nPing Chen*, Qin Xue, Wenfa Xie, Guohua Xie, Yu Duan, Yi Zhao, Shiyong Liu*, Liying Zhang, and Bin Li\nApplied Physics Letters, 95 (2009) 123307\nhttp://doi.org/10.1063/1.3234379\n[6] Highly efficient blue top-emitting device with phase-shift adjustment layer\nYanlong Meng, Wenfa Xie, Guohua Xie, Letian Zhang, Yi Zhao*, Jingying Hou, and Shiyong Liu\nOptics Express, 17 (2009) 5364-5372\nhttp://doi.org/10.1364/OE.17.005364\n[5] Pure red organic light-emitting diode based on a europium complex\nQin Xue, Ping Chen, Jianhua Lu, Guohua Xie, Jingying Hou, Shiyong Liu, Yi Zhao*, Liying Zhang, and Bin Li\nSolid-State Electronics, 53 (2009) 397-399\nhttp://doi.org/10.1016/j.sse.2009.01.016\n2008\n[4] Performance improvement of inverted polymer solar cells with different top electrodes by introducing a MoO3 buffer layer\nChen Tao, Shengping Ruan, Xindong Zhang, Guohua Xie, Liang Shen, Xiangzi Kong, Wei Dong, Caixia Liu, and Weiyou Chen*\nApplied Physics Letters, 93 (2008) 193307\nhttp://doi.org/10.1063/1.3026741\n[3] Color-stable and efficient stacked white organic light-emitting devices comprising blue fluorescent and orange phosphorescent emissive units\nPing Chen*, Qin Xue, Wenfa Xie, Yu Duan, Guohua Xie, Yi Zhao, Jingying Hou, Shiyong Liu, Liying Zhang, and Bin Li\nApplied Physics Letters, 93 (2008) 153508\nhttp://doi.org/10.1063/1.2998598\n[2] Influence of connecting units’ thickness on tandem organic devices’ performances\nMingjun Liu, Ping Chen, Qin Xue, Fangfang Jiang, Guohua Xie, Jingying Hou, Yi Zhao*, Liying Zhang, and Bin Li\nMicroelectronics Journal, 39 (2008) 1622-1625\nhttp://doi.org/10.1016/j.mejo.2008.02.018\n[1] Very low turn-on voltage and high brightness tris-(8-hydroxyquinoline) aluminum-based organic light-emitting diodes with a MoOx p-doping layer\nGuohua Xie, Yanlong Meng, Fengmin Wu, Chen Tao, Dandan Zhang, Mingjun Liu, Qin Xue, Wen Chen, and Yi Zhao*\nApplied Physics Letters, 92 (2008) 093305\nhttp://doi.org/10.1063/1.2890490\n团队成员\n暂无内容\n工作经历\n暂无内容\n教育经历\n暂无内容\n社会兼职\n暂无内容\n研究方向\n暂无内容\n其他联系方式\n办公室电话：\n邮箱：\n访问量：次\n最后更新时间：--\n",
    "research_section": "",
    "education_section": ""
  }
}